,Headline,Body text
72,Trump Holds Diplomatic Ceremony To Formally Welcome Coronavirus To United States,"WASHINGTON'Declaring that he was looking forward to showing the influential global entity around the country, President Donald Trump held a diplomatic ceremony Wednesday to formally welcome the coronavirus to the United States. 'This is a historic day for America, and I hope that the coronavirus will appreciate our efforts to give it a warm reception and work with us to build a thriving, mutually beneficial relationship,' said the president, announcing that Covid-19 would join him on the White House South Lawn for the presentation of an American flag accompanied by a military brass band, before a meeting with high-ranking administration officials and leaders from the business community in the Oval Office. 'We have a full itinerary planned over the next few days in which will tour a variety of Washington cultural sites, newly built manufacturing facilities, and even the state-of-the-art Johns Hopkins Hospital, so the coronavirus can observe firsthand the best of American pride and ingenuity. We are excited to develop a stronger bond with such an influential force in the international community, and we hope that a strong partnership with the coronavirus could lead to further diplomatic relations with H1N1, SARS, and other prominent global viruses.' At press time, a Trump administration spokesperson announced a change to the diplomatic itinerary after the coronavirus had expressed an interest in touring the CDC director's lungs."
73,"Tell Me About It, Stud,' Says Pleather-Clad Elizabeth Warren On Debate Stage In Effort To Court Bad Boy Demographic",
74,Moderators Kick Off Debate By Asking Whether Bloomberg Ready To Get Shit Rocked Again,"CHARLESTON, SC'As the televised event featuring the leading contenders for the Democratic Party presidential nomination got underway Tuesday evening, CBS moderators kicked off the debate by asking whether Michael Bloomberg was ready to get his shit rocked again. 'Our first question is for Mayor Bloomberg: How will you respond to another two hours of the other nominees just completely wrecking your shit?' said CBS This Morning co-host Gayle King, citing the fact that the billionaire former New York City mayor had spent the debate six days earlier 'getting absolutely bodied' and wondered whether he had a plan to prevent 'a complete and total roasting' from happening again. 'Mr. Bloomberg, do you believe that you prepared this time, and is it going to be enough? Because from where we're sitting, you got ripped a new one last debate, and now you're about to be hit from every side. Honestly, after seeing how easy it was last time, we wouldn't be surprised if the other candidates are even better prepared to tear you apart. Tonight, the whole country is watching to see if you have any plan to avoid getting fucking hammered again. You ready?' Sources confirmed that fellow CBS moderator Norah O'Donnell then interjected and told Bloomberg that they would give him 30 seconds to run off the stage if he still wanted to save himself before it started."
75,Klobuchar Hoping To Distinguish Herself During Debate As Only Candidate Not Sucker Punched In Gut Moments Before Stepping On Stage,"CHARLESTON, SC'Stressing that the contrast between herself and her rivals could not be starker, presidential candidate Amy Klobuchar told viewers at Tuesday night's Democratic debate that she remained the only candidate who had not been sucker punched in the gut moments before stepping on stage. 'Tonight, I'm asking voters to really think about the distinct choice they're being offered between a heartland Democrat with a record of serious accomplishments and six other candidates who have spent this entire debate doubled over and collapsing in front of their podiums or wheezing for air,' said the Minnesota senator, pointing to her distinguished record of not getting absolutely clocked in the moments before a national television appearance before gesturing across the stage at a whimpering Bernie Sanders clutching his stomach as he rolled around in agony. 'Ask yourself, if Elizabeth Warren wasn't prepared to get slugged right in the breadbasket as she stepped into the spotlight, then do you really think she'll be ready for the presidency? Now you've seen what my fists are capable of this evening, and if you're ready for a different type of candidate'one who isn't whimpering and begging for mercy'then I promise you a place with me.' At press time, Klobuchar had torn into Michael Bloomberg's supposedly tough-on-crime record as the dry heaving former New York City mayor began to retch onto the debate floor."
76,Elena Kagan Worried She's A Fraud After Being Only Female Justice Not Called Out By Trump,"WASHINGTON'Expressing doubt over whether she deserved of all her accolades, Supreme Court Associate Justice Elena Kagan was reportedly worried Tuesday that she was a fraud after being the only female justice not called out by President Donald Trump for being biased against him. 'Has my career meant nothing? I feel so invisible,' said Kagan, gazing at her reflection in a mirror and questioning what it was her fellow female justices have that she herself lacks. 'I mean, I was solicitor general as well as dean of Harvard Law School and I thought that was impressive, but does that even really mean anything if the president isn't calling on me to recuse myself from cases involving him? This man should hate me, yet he hasn't said a word about me voting against his wealth test for immigrants, or any of my other rulings. Am I just a big phony?' At press time, Kagan was trying to comfort herself by considering that a mistaken Trump might think she was actually a Bush appointee."
77,,
78,Trump In India Hails Blossoming Relations Between The 2 Planets,"AHMEDABAD, INDIA'Representing the United States during a diplomatic visit to India, President Donald Trump hailed the blossoming relations between the two planets during a rally Monday at the 110,000-seat Motera Stadium. 'Although we may come from different worlds, and our civilizations are separated by millions of lightyears, the bonds we share are still incredibly powerful,' said Trump, who marveled aloud at the strange vegetation and peculiar culture of the foreign planet, remarking to aides that the inhabitants of India were 'a lot like us,' despite their extraterrestrial origin. 'When I landed here in my flying craft after a long journey at warp speed through multiple galaxies, your entire planet came out into the streets to welcome me as if I were a member of your own species. That's something I'll never forget. May our two countries continue to exist in interplanetary harmony, sending a message of peace to the rest of the universe.' Trump later complimented Indian prime minister Narendra Modi's efforts to combat the intergalactic Muslim threat that puts their shared star system in danger."
79,Embarrassed Heart Surgeon Admits He May Have Accidentally Left Sanders' Medical Records In Candidate's Chest,"LAS VEGAS'Acknowledging the blunder following public pressure that his patient release the confidential documents, embarrassed heart surgeon Dr. Michael Sharrer admitted to reporters Monday that he may have accidentally left Bernie Sanders' medical records in the candidate's chest. 'Honestly, I just set them down for a second, and before I knew it he was all closed up,' said Sharrer, who speculated that he must have misplaced the Vermont senator's health records inside Sanders' thoracic cavity while performing the stent procedure with the scalpel in one hand and the files in the other back in October. 'It was a manila folder filled with all kinds of test results and charts. It probably got tucked behind the rib cage. I really should have been more careful considering that was our only copy. We could try an X-ray, but they might be difficult to read because they're probably all bloody. Man, we should really switch to digital records.' At press time, Sanders' critics were calling upon the presidential candidate to cut open his chest to release the records."
80,"Trump Administration Rolls Back Hunting Regulations Forbidding Use Of Chokeholds, Eye Gouging On Birds","WASHINGTON'In a legal measure that will greatly expand the options available to American sportsmen, the Trump administration announced Thursday that it would repeal legacy regulations forbidding the use of controversial chokeholds and eye-gouging when hunting game birds. 'Although animal rights activists have long decried placing grouse in sleeper holds, piledriving pheasants, and headbutting doves, we recognize that these inarguably effective moves have a long tradition among wingshooters,' said President Donald Trump in a press conference, adding that no less a man than Theodore Roosevelt had thought nothing of roundhouse kicking a brace of ducks for his dinner. 'They call the move the 'Crossface Chicken Wing' for a reason. Furthermore, banning the use of the common folding chair as an implement for slamming birds across the head is a holdover from the days of ignorant environmentalists who don't respect traditional hunting. True woodsmen know that respecting nature often means wrapping barbed wire around your fist to pummel a Canada goose or digging your thumbs into the eyes of a woodcock, and that there isn't a hunter alive who wouldn't curb stomp a wild turkey.' President Trump then posed for photographs while repeatedly smashing a quail beak-first into one of the White House's marble columns."
81,Experts Concerned Pale Russian Mystic Constantly At Trump's Side May Attempt To Influence 2020 Election,"WASHINGTON'Increasingly troubled about the role the self-proclaimed visionary and healer might play in the presidential race, intelligence experts expressed concerns Friday that Volokov Molchalin, the pale Russian mystic constantly at President Donald Trump's side, may attempt to influence the 2020 election. 'While we're unsure exactly what Volokov is whispering into Trump's ear'or if it's a known language at all'it's the consensus of the intelligence community that he likely intends to meddle in the upcoming election, perhaps by using his self-professed hypnotic powers to sway the American public,' said National Intelligence Director Joseph Maguire, noting that the long-bearded Eastern Orthodox prophet had enjoyed unprecedented access to the Oval Office since laying his hands on the president's thigh in early June and allegedly curing him of an internal hemorrhage. 'What's more unsettling is that Volokov has only grown more brazen in his attempts to alter the president's behavior, encouraging Trump to purify himself by self-flagellating, filling the West Wing with frankincense, or repeating occult incantations until his eyes roll back in a mystical trance. We've also received reports that Volokov can read minds, which would obviously make any counterintelligence efforts difficult, if not impossible.' At press time, terrified officials had escalated their warnings after a failed assassination attempt in which repeated stabbings, a gunshot wound to the head, and an apparent drowning in the freezing Potomac River failed to end the Russian mystic's life."
82,Bloomberg Housekeepers Brace For Another Day Of Dressing Up Like DNC Candidates And Letting Boss Beat Them In Debate,"NEW YORK'Standing behind podiums scattered around the living room, Mike Bloomberg's housekeepers braced for another day of dressing up like DNC candidates and letting their boss beat them in a debate, sources confirmed Thursday. 'I'm supposed to be polishing the silver today, but instead I have to wear a stupid white wig and let Mr. Bloomberg attack the feasibility of my Medicare-for-all plan,' said maid Flora Bishop, who feared the 15-person housekeeping staff would be unable to complete their daily cleaning tasks as their boss forced them to restart the debate yet again after fumbling a question about prison reform. 'We basically just stand around and let him tear our policies apart until he feels like he's won. Usually, I'll just say something about how all my ideas are bad compared to his so I can get back to the laundry. I feel terrible for the landscaper who played Buttigieg last time. Mr. Bloomberg fired him after he made a really good point about trying to buy the election.' At press time, the housekeepers were frantically motioning for the chauffeur, who was acting as moderator, to stop pressing their boss on stop-and-frisk policing tactics."
83,,
84,Biden Begging Donors To Stop Sending Money So He Can Quit Race,"WASHINGTON'Imploring his supporters to relieve him of his obligations on the campaign trail, former vice president and current presidential candidate Joe Biden reportedly begged his donors Thursday to stop sending him money so he could quit the presidential race. 'Look, folks, we are at an important crossroads in our bid for the nomination, and I'm asking you from the bottom of my heart to please, please stop giving to my campaign so I can just end it already,' Biden wrote in an email sent to every individual, corporation, and political action committee that has contributed to his campaign, adding that with their generous help, they could help put him out of his misery at this 'crucial juncture' right before the Nevada caucus. 'I'm going to be honest with you. We're being outpaced in fundraising by the other campaigns, and that is great, because I am very, very tired and ready to admit defeat; so please, whether you have $1 or $100 to spare, don't send either. I know I can count on you to support me as I head back into retirement and try to pretend none of this ever happened.' At press time, sources confirmed Biden began openly weeping when he received a $4 million surge in donations."
85,"Four Quarts Make A Gallon. The Frontal Lobe Controls Decision Making. The Ottoman Empire Dissolved In 1922,' Says Amy Klobuchar, Continuing To Name Trivia Facts Hours After Debate Ends",
86,Stephen Miller Spends Entire Honeymoon In Hotel Room Calling ICE On Cleaning Staff,
87,Increased Airtime Of Chantix Commercials Results In Ray Liotta Qualifying For Democratic Debate,"LAS VEGAS'In a powerful testament to the role television advertising still plays in driving national polls, increased airtime of commercials for tobacco cessation aid Chantix led to celebrity spokesperson Ray Liotta qualifying for Wednesday night's Democratic Debate. 'Chantix has made some especially aggressive ad purchases in recent months that helped spread the word about Ray Liotta and his struggle to find a stop-smoking aid that works for him,' said polling expert Kevin Michaels, stressing that the extensive television ad campaign familiarized Americans with Liotta as a 'father, actor, and ex-smoker' and directly led to the polling surge that secured his place on the debate stage. 'What these ads have done for key sections of the electorate is not only boost awareness of Liotta, but also expose voters to his difficulties to quit cold turkey before eventually finding a way to overcome his urge to smoke with Chantix. It's a message of hope that's clearly resonating with voters.' At press time, experts suggested the strategy may have backfired after Amy Klobuchar hammered Liotta for pushing a product that can cause changes in behavior, depressed mood, and nausea."
88,Chuck Todd Reminds Candidates That If They Want More Time To Speak There Are Melee Weapons Under Each Of Their Lecterns,
89,"I'll Rule You Peasants With An Iron Fist,' Says Bloomberg To Standing Ovation During DNC Debate","LAS VEGAS'In a demonstration of the high level of enthusiasm the former New York City mayor enjoys among the electorate, surging presidential candidate Michael Bloomberg was met with a standing ovation during the Democratic debate Wednesday as he promised to 'rule you peasants with an iron fist.' 'Kneel before me and tremble, you piteous wretches, for I am your new sovereign ruler and my will is infallible,' said Bloomberg, cutting into his rivals' speaking time as his pledge to 'vanquish my enemies and reward my supplicants' was met with thunderous applause by thousands of assembled audience members. 'You peons, you mean as little to me as a clump of dirt to a mighty mountain, and I'll step on the necks of every last one of you on my quest for greater and greater power. Gaze upon your new God and fear my capricious wrath.' At press time, the audience had broken out into chants of 'Bloomberg! Bloomberg!' as armed guards emerged from the exits to indiscriminately beat them with batons."
90,Last-Second DNC Rule Change Requires Candidates Spend At Least $300 Million Of Own Fortune To Make Debate Stage,
91,Panicking Aides Finally Locate Biden At Wrong Venue Following Cirque Du Soleil Performers Onstage,"LAS VEGAS'After frantically searching for the former vice president in the hours leading up to Wednesday night's debate, panicked campaign aides reportedly located Joe Biden at Las Vegas' Treasure Island Hotel, where the candidate appeared to have followed a Cirque du Soleil troupe onstage. 'There he is, up there'those circus clowns are tossing him back and forth,' said visibly relieved senior adviser Anita Dunn, waving her arms at the seven-term former U.S. senator, who was attempting to make an impassioned speech about his legislative record despite being severely entangled in aerial silks and dangling 50 feet in the air. 'Even if we got him down from there right now, we still wouldn't make it to the debate venue on time, and he does seem to be shouting his most important talking points at the guys playing those big Japanese drums and the two musclemen flying around on bungees. To be honest, I haven't seen him looking this coherent in a long time. Why don't we just let the vice president have a nice night for once?' At press time, Biden was overheard berating a unicycle rider he 'didn't like the looks of' from the confines of a large, whimsical birdcage."
92,"I Love My Wife Marcia And 2 Beautiful Kids, Tad And Hayden,' Says Buttigieg In Latest Campaign Shift","SOUTH BEND, IN'Quipping that if elected, he would be a father first and president second, Democratic candidate Pete Buttigieg told reporters Wednesday that he loved his 'wife Marcia and two beautiful kids, Tad and Hayden' in his latest campaign shift. 'First, I'd like to thank my incredible rock of 15 years, Marcia, and boys, why don't you come on up to the stage and give your pops a hug?' said the former mayor of South Bend, beckoning to his newly revamped campaign staff and inviting up a tall, slender woman with two suit-clad young boys who immediately sprinted over Buttigieg yelling 'Daddy, Daddy.' 'This beautiful, intelligent woman right here'she got me through law school, she got me through my mayoral races, and she's going to get us to the White House. And Tad and Hayden, thank you for coming here today. But you better get going'Daddy knows you have homework to do!' At press time, Buttigieg grabbed his wife and gave her a long kiss on the lips before shrugging and telling the crowd, 'Happy wife, happy life!'"
93,Rod Blagojevich Somehow Already Governor Of Illinois Again Minutes After Prison Release,
94,Trump Celebrates New Hospital Opening With Oxygen Tube-Cutting Ceremony,
95,Bloomberg Hires Thousands Of Canvassers To Stop Black Men On Street And Force Them To Hear Campaign Pitch,"NEW YORK'Citing polling data that suggested the former mayor was tracking poorly among 18- to 25-year-old African Americans, Michael Bloomberg's presidential campaign hired thousands of canvassers Friday to stop black men on the street and force them to hear his campaign pitch. 'We want to make sure black voters can't walk down the street without hearing Mike's message loud and clear,' said campaign spokesperson Julie Wood, clarifying that canvassers have received training on the proper tactics for stopping black men and throwing them onto the ground while delivering Bloomberg's talking points. 'We've also instructed our canvassers to confiscate any materials supporting other candidates. In some cases, we might actually take some men into custody and bring them back to campaign headquarters. This is a massive undertaking that will run well beyond Super Tuesday. We've already set up Bloomberg-branded vans in black neighborhoods across the country to spread our message. It'll all be worth it once these young black men hear what Bloomberg has to say about funding social security while they're pressed up against a brick wall with an elbow digging into their backs.' At press time, Bloomberg defended his campaign's decision to stop black high schoolers on the street, insisting that they'd be of voting age soon enough."
96,A Guide To The USMCA Trade Deal,"The United States'Mexico'Canada Agreement, which would replace NAFTA as the act governing North American trade, has been ratified in both the U.S. and Mexico. The Onion takes a look at the most important components of the USMCA trade deal. Stipulates at least 62.5% of all North Americans must be cars. U.S.'Canada cow swap every other Saturday in Minnesota. Both NAFTA and USMCA contain same number of vowels to make transition as smooth as possible. Cash only. Removes NAFTA's hated truck nut tariff. Significantly strengthens labor violations. Intellectual property copyright terms extended to 70 years as personal favor to Jim Davis. Completely revamps legal definition of what constitutes refried beans. Agreement must be revisited in six years, no matter how cringey it is for the countries to look back at what they wrote when they were younger."
97,Nevada Addresses Concerns About Election Security By Switching To Electronic Voters,"LAS VEGAS'In an effort to ensure reliable results in its Feb. 22 presidential caucus, the Nevada State Democratic Party announced Friday that it had addressed election security concerns by upgrading to a new system of electronic voters. 'There is a lot of potential for human error when you have people recording their votes on paper, but we believe we can greatly reduce inaccuracies by digitizing the entire process, including the voters themselves,' said party chair William McCurdy, who explained that electronic voters select candidates faster and more precisely than their human counterparts, allowing delegates to be awarded to the correct candidate immediately and eliminating the need to contest the outcome. 'We originally planned to use a new app to tabulate votes, but after witnessing the difficulties experienced in Iowa's caucuses, we thought, 'Why not use an app to cast the votes, too?' It's far more efficient than systems we've used in the past, and the best part is that the results will be available as soon as'well, now, if you'd like them.' At press time, sources confirmed the Nevada party had awarded Joe Biden the 1,990 delegates necessary to secure the Democratic nomination for president."
98,Mike Bloomberg: 'I Apologize For The Damages My Past Policies Have Caused To The Negro Community',From The Archives:
99,Jimmy Carter Added To Mount Rushmore After Becoming 5th Former President To Bowl Perfect 300,"KEYSTONE, SD'Unveiling the updated sculpture in an official ceremony before a crowd of thousands, the National Park Service added former President Jimmy Carter to Mount Rushmore Thursday after he became the fifth former U.S. president to bowl a perfect 300 game. 'Today, we honor a man who has cemented his place in history by casting his likeness on our great nation's largest bowling memorial,' said National Park Service deputy director David Vela, echoing the feelings of shock and joy experienced across the nation after news broke that 95-year-old Carter had achieved the rare feat by bowling a strike in every frame. 'It's been over a century since we last added Theodore Roosevelt's face to the design. Of course, Bill Clinton was close, but he was disqualified for using bumpers. But Jimmy Carter's historic game belongs to the ages now, and only time will tell if another American leader can live up to the standard again.' At press time, the National Park Service was making plans to erect a second obelisk near the Washington Monument after President Carter reportedly scored a perfect 10.0 on his gymnastics vault routine."
100,Pros And Cons Of Abolishing The Senate,"Established by Article 1 of the U.S. Constitution and first convened in 1789, the Senate has served as the upper chamber of Congress, but as America has grown and populations have shifted, its continued existence as a chamber that gives every state an equal number of representatives has come under scrutiny. The Onion takes a look at the pros and cons of abolishing the Senate. Founders devised Senate several generations before anyone could have even conceived of Oklahoma Haven't abolished anything in a while Senate building could make for some nice new downtown lofts Could lead to formation of fun new legislative body with cool name like The Assembly or The Council of Elders Senate serves as a safety valve in case democracy functioning too well Would be mean after Founding Fathers put so much work into it Kind of terrifying to think about what Mitch McConnell would get up to in private sector Derails career track for children of current senators "
