,Headline,Body text
0,Timeline Of Presidential Polling,"As the 2020 presidential race heats up, attention has turned to presidential polling and the wisdom of relying on an industry that generally predicted the wrong outcome in 2016. The Onion takes a look at the history of presidential polling. 1935: George Gallup founds American Institute of Public Opinion in attempt to quench his endless thirst for juicy voter gossip. 1936: Someone is calling on the telephone! Imagine that, Stanley, a call on the telephone! And they want to know who we think should be our president!  1940: Polls confirm what everyone knew intuitively: Wendell Willkie sucks. 1948: Pollsters' methods questioned after they failed to predict there would be an election that year. 1960: Kennedy consistently polls ahead of Nixon when voters asked who they could see being assassinated as president. 1988: Sarah Summers of Des Moines, IA correctly observes that ignoring endless months of polling makes life happier. 1992: Third-party candidate Ross Perot creates challenges for pollsters because three is more than two. 2000: Polls don't take into account that Supreme Court can just pick whoever they want. 2016: Margin of error wins again."
1,Self-Loathing GOP Congressman Can't Believe He's Been Reduced To Defending Necessity Of Public Schools,"WASHINGTON'As the nation falls deeper into the grip of a pandemic that has forced compromises upon his most cherished principles, a self-loathing Sen. Lamar Alexander (R-TN) acknowledged Friday he could not believe he had been reduced to defending the necessity of public schools in a civil society. 'I hear these words coming out of my mouth, these requests for more federal dollars so public schools can reopen, and I wonder, 'My God, what have I become?'' said Alexander, who wondered aloud whether he might still be able to console himself by diverting money from lunch programs and using it to build more charter schools. 'I can barely recognize myself anymore, this man who goes on television and talks about how a return to normalcy in American life depends upon increasing funds to public schools and ensuring they have everything they need to succeed. Ugh, how has it come to this? Has the half century I've spent in politics been a complete waste?' At press time, Alexander had reportedly cheered himself up by thinking about all the public school teachers and staff whose health would be threatened by reopening too soon."
2,Nancy Pelosi Calls Jamaal Bowman To Scold Him For Winning Primary,"WASHINGTON'Following the progressive challenger's victory over 16-term incumbent Rep. Eliot Engel (D-NY), House Speaker Nancy Pelosi phoned Jamaal Bowman to scold him for winning his primary race, sources confirmed Wednesday. 'I just wanted to call and personally reprimand you for your victory,' said Pelosi, extending her sincerest indignation to the former Bronx middle school educator, who is expected to easily win the general election in his heavily Democratic congressional district. 'I understand there are some mail-in ballots that still need to be counted, but it appears you won big last night and energized a lot of first-time voters and young people we absolutely did not want voting in this primary. So allow me to extend my sincerest fuck-you for everything you've done. Obviously, we're going to be working together soon, so I look forward to crushing you the first chance I get.' Pelosi added that when things became official in November, she would call again to express how frustrated she was to welcome Bowman to Congress."
3,Georgia Secretary Of State Vows To Investigate Why Some Residents Forced To Wait 2 Centuries To Vote,
4,Congress Announces Willingness To Offer Black Lives Matter Protesters Holiday Or Statue,"WASHINGTON'Emphasizing the importance of taking concrete steps to address systemic racism and police brutality in the United States, Congress reportedly announced Monday their willingness to offer Black Lives Matter protesters a holiday or statue. 'We have seen people around this nation calling for dramatic change, and I can assure you that we intend to meet this moment with the support it deserves'a nice memorial, say, or perhaps a national day of remembrance that individual states can decide to declare an official day off work if they want,' said Speaker of the House Nancy Pelosi (D-CA), echoing a bipartisan group of representatives that if these solutions were not acceptable to leaders of the Black Lives Matter movement, Congress was also willing to consider painting a mural. 'Whether it's one fairly prominent statue of a black person and white person holding hands in D.C. or several smaller ones in cities nationwide, we in Congress are committed to acknowledging the validity and importance of the Black Lives Matter movement. We will make sure that your voices are heard in small script on the bottom of federal calendars or in a bronze statue in some D.C. park.' At press time, Congress announced that it was also open to sending all Black Lives Matter movement leaders cupcakes. "
5,Democratic Leaders Announce That They've Learned The Words 'Systemic Racism',"WASHINGTON'Democratic leaders announced Wednesday that they have learned the words 'systemic racism' and that they were very excited to have done so. 'We have been informed of the phrase 'systemic racism,' and, beyond that, we plan to use it in several sentences,' said Minority Leader Chuck Schumer in an impromptu press conference that also included House Speaker Nancy Pelosi and DNC Chair Tom Perez, who all echoed the fact that they have seen these two words next to each other on a sheet of paper given to them by aides, have read that sheet of paper, and will proceed to repeat those words both in conversation amongst themselves and with reporters. 'We understand that it is a phrase, and we will include this phrase in sentences we speak. In fact, you might see us on television using this set of words very soon. All of this is to say that today, we have discovered two new words that we are supposed to use. That's all.' At press time, the Democratic Party had announced a bold new initiative to combat systematic rhotacism in 2020. Here's a list of organizations where you can donate."
6,"She Needs A Bible Now, Fuckwad'Yes, It's For An Epic Clapback!' Yells Panicked Pelosi Aide Into Phone","WASHINGTON'Following reports that Donald Trump sprayed tear gas at protestors and members of the clergy before a photo-op at St. John's Church, a panicked aide to Speaker of the House Nancy Pelosi reportedly picked up the phone Tuesday and yelled 'she needs a Bible now, fuckwad'yes, it's for an epic clapback.' 'Look, I don't care how you get it, but get it now, because the clapback queen needed a photo of her in a pink pantsuit, reading a bible on Twitter, Facebook, and the front page of CNN five fucking minutes ago,' said the hoarse, screaming aide, who then added that if she didn't see a holy text within the next 10 minutes, 'your ass will never work in Washington, D.C. again.' 'Listen, you little bitch, I don't care if it's the middle of a global pandemic, and I don't give a shit if every bookstore is closed'this is the voice of a generation, so you will rob a fucking church if you have to, do you understand? This is going to be a fucking epic-Trump-takedown-iconic-girlpower-slam. Now hurry the fuck up. Before I end you.' At press time, the aide had slammed down the phone only to pick it up 30 seconds later and yell, 'Oh yeah, and refill the Jeni's ice cream in the fridge, or I'll rip off your head and feed it to her fucking dog.' Here's a list of organizations where you can donate."
7,"DNC To Streamline Fundraising By Cutting Out Unnecessary Cost Of Campaigns, Candidates","WASHINGTON'In a letter to top donors explaining how their contributions would now be spent more efficiently than ever, the Democratic National Committee announced plans Tuesday to streamline its fundraising by completely eliminating the unnecessary costs of campaigns and candidates. 'We're confident that once our party is freed from the burden of putting forth nominees and running expensive campaigns, we'll finally be able to focus all our efforts on generating as much revenue as possible,' wrote DNC chairman Tom Perez, adding that he hoped an upcoming series of fundraisers to which the letter's recipients were invited would help pay for even bigger fundraisers down the line. 'So just go online, make your donation, and we'll take it from there. Whether you're able to give $5 a month or cut us a check for the annual maximum of $35,500, we promise to take that money and put it toward making even more money. We're confident that with no candidates or platforms to disagree on, Democrats of every stripe will unite to give us the financial support we've always wanted. Together, we can do this.' At press time, reports confirmed Perez was threatening to disburse all cash on hand to President Trump's reelection campaign if donors failed to reach the DNC's spring fundraising goal."
8,Pros And Cons Of Voting By Mail,"Long-term social isolation plans due to the coronavirus pandemic have shined the spotlight on voting by mail for the remaining primaries and even the November elections, a process that is already used in some states but has its share of critics. The Onion looks at the pros and cons of voting by mail. Furiously research ballot measures at last minute from comfort of your own home Delicious adhesive on envelope Creates nice, tidy piles of mail-in ballots to be conveniently lost somewhere No need to rent tux Potential several-day delay before being let down by outcome Walk to mailbox a real drag Eliminates only plausible excuse for loitering at middle school Candidates still fucking awful Unclear if USPS can handle huge responsibility right in middle of getting dismantled Risks easily facilitating nation's participation in democracy"
9,Biden Campaign Email Trails Off Halfway Through,
10,Biden Campaign Considering Using The Internet To Attract Voters,"PHILADELPHIA'Saying it was definitely something they were looking into, officials with Joe Biden's presidential campaign confirmed to reporters Wednesday they were actively exploring the possibility of using the internet to attract voters. 'We may use it, we may not, but yes, it is one of the outreach tools on our radar at this time,' said Biden 2020 co-chair Cedric Richmond, adding that the campaign 'didn't want to get ahead of itself,' but if surveys showed there was a sizable block of registered voters using the technology, it might eventually hire two or three staffers to work on the internet full-time. 'It's pretty cutting-edge stuff. The web can send text and images right to people's computer screens, so it may actually turn out to be an effective means of spreading the vice president's message. And who knows, there might even be a way to raise money through the internet. We'll be conducting more research into the matter as soon as we install the free trial disk we have in our files.' At press time, the Biden campaign had reportedly published a single standard-definition photo of the presumptive Democratic nominee on a Blogger account set to private."
11,Nancy Pelosi Assures Democratic Reps They Don't Need To Try Being Productive During Stressful Pandemic,"WASHINGTON'Encouraging lawmakers to avoid holding themselves to the impossible standard of protecting Americans, Speaker Nancy Pelosi (D-CA) assured Democratic House representatives Wednesday they don't need to try being productive during the stressful pandemic. 'These uncertain times are difficult for everyone, so don't feel like you need to push yourself to constantly come up with detailed plans to avert a new depression,' said Pelosi, insisting that House Democrats should tune out the nagging voice of constituents pressuring them to ease mass suffering by enacting essential social safety measures before it's too late. 'Don't create a bunch of tension in your life by attempting to secure aid to unemployed Americans struggling to pay for basic necessities. Supporting workers is not going to happen anyway, so don't get all stressed. Look, this is not the time to beat yourself up over whether you're doing enough to prevent a cataclysmic economic decline. Take a breather. Sometimes it's better to just plop down on the couch and watch movies all day.' At press time, Pelosi emphasized there would be plenty of time to work on enacting legislation after the pandemic was finished cratering every aspect of American life."
12,"Obama: 'I'm So Proud To Endorse Joe Biden'That's Who They Went With, Huh?'For President'","As the 2020 presidential race heats up, attention has turned to presidential polling and the wisdom of relying on an industry that generally predicted the wrong outcome in 2016. The Onion takes a look at the history of presidential polling. 1935: George Gallup founds American Institute of Public Opinion in attempt to quench his endless thirst for juicy voter gossip.        "
13,"It Was, For, Uh, Medical Reasons,' Says Doctor To Boris Johnson, Explaining Why They Had To Give Him Haircut","LONDON'Calling the procedure 'a fast, er, effective way' to treat symptoms of the Covid-19 virus, doctors at St. Thomas' Hospital reportedly told British prime minister Boris Johnson that the haircut he'd received on Friday 'was for, uh, medical reasons.' 'Well, you see Prime Minister, because of your severe respiratory issues, we, um, actually needed to access that part of your head for a...surgery thing, yes,' said senior clinician Dr. Randal Jensen, taking long, awkward pauses as he looked between his medical charts and Johnson's new head of short, well-coiffed hair. 'Simply put, if we had kept your hairstyle the way it was, you could have risked death or something else, probably. We believe this is because the uh...keratin in your hair is related to your lungs, but don't worry too much about that right now. We actually do it to all our patients. Right, yes, we definitely do that.' At press time, the prime minister had reportedly informed his medical team that after his emergency lifesaving haircut, he'd never felt better. "
14,"I Congratulate Joe Biden, A Very Decent Man,' Says Bernie Sanders In Unprovoked Attack On Democratic Party Unity","As the 2020 presidential race heats up, attention has turned to presidential polling and the wisdom of relying on an industry that generally predicted the wrong outcome in 2016. The Onion takes a look at the history of presidential polling. 1935: George Gallup founds American Institute of Public Opinion in attempt to quench his endless thirst for juicy voter gossip.        "
15,Wisconsin Primary Voters Receive 'I Voted' Gravestones,"As the 2020 presidential race heats up, attention has turned to presidential polling and the wisdom of relying on an industry that generally predicted the wrong outcome in 2016. The Onion takes a look at the history of presidential polling. 1935: George Gallup founds American Institute of Public Opinion in attempt to quench his endless thirst for juicy voter gossip.        "
16,Senator Kelly Loeffler Asks For Prayers After Losing $3 On Single Stock Due To Coronavirus,"WASHINGTON'Begging her constituents to keep her family in their thoughts in the coming days, Sen. Kelly Loeffler (R-GA) asked for Americans to send her prayers in an emotional press conference Tuesday in which she announced that she had lost as much as $3 on a single stock due to the coronavirus. 'I am asking for all of your support in helping me through this difficult time, a time of incalculable financial loss that I hope none of you have to experience,' said the junior Georgia senator, often straining to hold back tears as she told reporters that she and her husband would be spending the coming weeks speaking with financial advisors about how to make sense of this unimaginable fiscal hardship. 'You tell yourself something like this can never happen to you, you pretend you're immune to the terrible effects of this pandemic, but then you check in with your investment advisor and the news is almost too much to bear. Three dollars. Gone forever. When Jeffery and I found out, we cried for hours. I'll never forget the memory of my beloved stock's market value. May God protect the rest of our portfolios during this challenging time.' At press time, Loeffler had started a GoFundMe to recoup the loss and raised over $90,000 in the first few minutes."
17,Georgia Governor Argues That Closing State's Beaches An Attack On Citizens' Fundamental Right To Get Wet 'N' Wild,"ATLANTA'With public health experts decrying his decision last week to reopen the state's beaches, Georgia Gov. Brian Kemp argued Monday that any government action limiting fun in the sun would constitute an infringement upon every citizen's fundamental right to get wet 'n' wild. 'Our forefathers fought and died to ensure future generations of Americans could enjoy certain God-given freedoms, among them the ability to head on down to the beach anytime one likes and have a splish-splashin' good time in the waves,' said Kemp, adding that he had no doubt the American colonists' decision to secede from Great Britain stemmed in part from concerns over whether the crown would continue to guarantee them unfettered access to sunshine, sand, and surf all summer long. 'If we cannot throw on a pair of trunks, wax down our boards, and shred those waves; if we cannot slip on some shades and work on our tans; if girls in bikinis cannot play a simple game of beach volleyball in the sizzlin' hot sun, then who are we, as a people? My God, 'from sea to shining sea''it's right there in the Declaration of Independence.' Kemp went on to state that Georgia's owners of beachfront property were exempt from his order and welcome to continue trammeling upon people's right to enjoy the ocean."
18,Trump Admits 18 New States To Increase Competition For Medical Supplies,"WASHINGTON'In an effort to attract better offers from governors forced into bidding wars over life-saving equipment, President Donald Trump admitted 18 new states Monday to increase competition for medical supplies. 'The free market works best with some healthy competition, so by increasing the number of U.S. states to 68, we can hopefully double the cost of ventilators,' said Trump, who noted that American Samoa, the U.S. Virgin Islands, Guam, the Northern Mariana Islands, Midway Atoll, Toronto, and Tijuana were among the 18 territories that had been fast-tracked into the Union. 'It's important our manufacturers are getting the best prices possible. We're sending 300,000 surgical masks to a new state in the middle of Maine we're calling Clovis. Nobody lives there, but it's going to help drive up demand. The Coral Princess cruise ship is also now a state, a beautiful floating place, and they're looking for PPE, too. We don't have enough for them, but we're looking forward to their bids.' At press time, Trump clarified Puerto Rico would remain an unincorporated territory. "
19,Southern Governors Argue Covid-19 Good Christian Virus That Wouldn't Dare Spread During Church,"TALLAHASSEE, FL'In a bold affirmation of faith during a time of widespread global pandemic, the governors of several Southern states confirmed Thursday they have exempted religious services from their shelter-in-place orders, arguing that Covid-19 is a good Christian virus that wouldn't dare to spread during church. 'As far as I can tell, this coronavirus is an upstanding and righteous disease that knows better than to continue its deadly outbreak within a house of God,' Florida Gov. Ron DeSantis said in a statement later echoed by Govs. Bill Lee of Tennessee, Greg Abbott of Texas, and Tate Reeves of Mississippi. 'If we were talking about some sort of secular, atheistic virus, churchgoers might have cause for worry. But I believe in my heart this highly communicable pathogen will show respect during services and not do anything to harm the Lord's flock on our day of rest. Now, what the virus does to the wicked, sinful people in our community'that's between it and God.' At press time, sources confirmed Southern governors had taken steps to ensure all mosques would be closed indefinitely."
20,Jared Kushner Says States Should Have Planned Ahead Before Joining The Union,"WASHINGTON'Speaking at a press conference to address the growing Covid-19 pandemic, White House senior advisor Jared Kushner admonished resource-stricken states this week that they should have shown some foresight and planned ahead before joining the Union. 'To any governors coming to me and saying the White House hasn't given them what they need, I would urge them to ask why they didn't consider these possibilities centuries ago when they first joined together into a federal republic?' said Kushner, singling out Texas' governor in particular and questioning why the Lone Star state didn't simply start stockpiling their own ventilators or face masks back in 1884 when they allowed the United States to annex them from Mexico.''Some of you, like Massachusetts or Virginia, have actually had several hundred years with the knowledge that our Constitution grants significant independence in resource allocation to individual states. Frankly, you could have decided way back in 1776 that this setup wasn't for you. Instead, you impulsively formed a unified nation without even considering the consequences. I'm sorry if I don't sympathize here.' Kushner stressed that he was tired of hearing excuses from states that didn't begin building a respirator cache in the 18th century because they were busy with westward expansion or that modern germ theory simply had not yet been developed."
21,,
22,Trump Tackles Medical Supply Shortage By Awarding ExxonMobil Contract To Drill For Ventilators In Arctic,"WASHINGTON'Saying there was no way the coronavirus could win with such amazing corporations on their side, President Donald Trump kicked off his plan to tackle the medical supply shortage Tuesday by awarding ExxonMobil an exclusive contract to drill for ventilators in the arctic. 'Today, the heroic crews at ExxonMobil will travel to Alaska's Arctic National Wildlife Refuge, where they will drill 6,000 feet below the earth in search of new, undiscovered mechanical breathing devices,' said Trump, signing the $86 billion deal that gave the oil company sole access to survey, drill, and extract from over 30,000 square miles of 'vast, untapped reservoirs of respiratory ventilators.' 'While this crisis is a challenge, I want to assure the American people that there are millions of medical devices lying just below the arctic surface, and all we need is ExxonMobil's vast network of drilling rigs to find them. That's why we're also announcing the construction of a long-distance ventilator pipeline, as well as an exclusive, multi-billion-dollar contract with Shell to begin extracting ventilators on Native American reservations throughout South Dakota.' At press time, President Trump had reportedly once again downplayed the need for medical supplies after one of ExxonMobil's largest offshore tankers exploded. "
23,Trump Delays Easter To July 15 To Keep Promise On Coronavirus,
24,Trump Announces Plan To Retrain Nation's 3 Million Unemployed Americans As Human Ventilators,"WASHINGTON'Taking drastic action to address the country's critical medical supply shortages as well as rising jobless claims, President Donald Trump announced a plan Friday to retrain the nation's 3 million unemployed Americans to work as human ventilators. 'We're going to put Americans back to work by teaching them to lock lips with infected coronavirus patients and pump air into and out of their lungs,' said Trump, who explained how the Department of Labor would be giving all out-of-work Americans an opportunity to take an accelerated training course to learn how to successfully provide ventilatory assistance to Covid-19 patients with their mouths. 'States asked for help, and we've listened. This is going to save hundreds, potentially thousands of lives, and put our nation's great service workers back on their feet. There are thousands of very, very sick people waiting across the country with their mouths gaping open.' At press time, Trump told reporters that if unemployment numbers continue to rise, that many of the jobless could take on roles as hospital beds."
25,What's In Congress' Coronavirus Stimulus Bill,"After days of frenzied negotiations, Congress passed a $2 trillion stimulus package to address economic issues caused by the coronavirus, the largest such aid package in U.S. history. The Onion takes a look at what's in the stimulus bill. Direct payments of $1,200 for single Americans, $2,400 for married couples, and $3,000 for those playing the field. $32 billion to an airline industry that charged you for a blanket on your last flight. Paywall taken off U.S. Unemployment Office website. More protections than you'd think necessary to safeguard American people from their president. Lot of money the government has spent decades telling Americans it didn't have and couldn't spend. Probably something that sounds very good and turns out to be very bad. Five dollars to Senator Ron Johnson for winning betting pool that Rand Paul would get virus first. Every family will receive $500 per child, but officials may not come to collect the children until May. Federal aid for independent contractors, such as Uber drivers and assassins. A stern reminder that this is a one-time thing."
