,Headline,Body text
187,Pete Buttigieg Blames Inability To Disclose Political Stances On NDA With Buttigieg Campaign,"CONCORD, NH'Declaring that he simply has no choice in the matter, White House hopeful Pete Buttigieg told reporters Friday that some political positions he holds cannot be disclosed because of a nondisclosure agreement he signed with the Pete Buttigieg presidential campaign. 'I would love to answer your questions, but back in early 2019, I signed a strict, binding contract with the Pete for America organization in which I agreed not to discuss such matters,' Buttigieg said during a candidate forum, explaining that while he would love to offer more detailed and convincing proposals on issues such as healthcare, foreign policy, and immigration, he is legally prohibited from doing so. 'There's nothing I'd enjoy more than elaborating on my tax plan, for example, but I can't talk about any views I may have held during the period of my candidacy. These are highly confidential policy initiatives. Unless the Buttigieg campaign agrees to release me from the NDA, I'm afraid there's simply nothing I can do.' At press time, the Buttigieg campaign was reportedly scrambling to perform damage control after details of Buttigieg's political stances had been leaked to the public."
188,Trump Orders National Christmas Tree Be Cut To One Inch Shorter Than He Is,
189,Matt Gaetz Solemnly Raises Pistol To Head After Realizing He Used Barron Trump's Name While Scolding Witness For Using Barron Trump's Name,
190,Sonny Perdue Argues Food Stamp Cuts Will Incentivize People To Get Exploitative Jobs That Won't Exist In 5 Years,"WASHINGTON'Responding to the criticism surrounding the Trump administration's recent decision to tighten restrictions on supplemental nutrition eligibility, Secretary of Agriculture Sonny Perdue argued Thursday that the food stamp cuts will incentivize people to go out and get exploitative jobs that won't exist in five years. 'Look, these cuts are not about kicking people off the food stamp rolls, but encouraging them to get off the couch and start looking for thankless, backbreaking work that will be rendered obsolete by either automation or outsourcing by 2025,' said Perdue, adding that the administration's goal wasn't to prevent Americans from affording food, but to create an empowering situation where U.S. citizens could barely have the means for sustenance because their degrading, short-term job, with severe physical and emotional hazards, forces them to work overtime without extra pay. 'We are hoping the new directive will serve as a gentle nudge for Americans to take their lives into their own hands by signing up for one, two, or even three demanding jobs from a hellish megacorporation that only cares about their bottom line. People shouldn't be relying on the government for free food, especially in this current Trump economy'there are tons of available positions that will push the boundaries of their physical and mental health, as well as significantly decrease their life expectancy, all in exchange for a meager subsistence that robs them and their families of their dignity.' Perdue also added that the new rules would work in tandem with the proposed cuts to Medicare, which the administration has argued will incentivize unemployed people to take up jobs that offer inhumane health care plans that don't cover essential services."
191,Boris Johnson Worried Anti-Semitism Accusations Against Labour Party Will Hurt Tories' Hold On Bigot Vote,"LONDON'Monitoring polls and news coverage of the upcoming elections, U.K. prime minister Boris Johnson reportedly expressed concern Thursday that continued accusations of anti-Semitism against the Labour Party will hurt the Tories' hold on the bigot vote. 'Those with prejudiced and discriminatory beliefs have long been a bedrock of the Conservative Party constituency, but I'm nervous that so many people attacking Labour as the party of anti-Semites will eat into our ability to win,' said Johnson, adding that he was concerned the volume of allegations that Labour Party leader Jeremy Corbyn wasn't doing enough to combat anti-Semitism in his own party could result in bigoted voters believing that Labour actually represented their values. 'When allegations first started coming out, I figured it would be a flash in the pan and the Tories could continue counting on the bigot vote, as we have for generations. It's really going to hurt us if people think Labour is the party for anti-Semitism based on a few things in the media and ignore the political reality, which is that the Conservatives have for decades reliably issued policy driven by prejudice and racial animus. But it's going to be a close election, and I'm worried if this doesn't stop, the Tories could be at risk of losing the Islamaphobe or even the white supremacist vote, and that would be devastating at the polls.' An increasingly desperate Johnson added that he was pondering saying or doing something extremely anti-Semitic in order to remind bigoted voters on the fence about which party best advocated their interests."
192,Jimmy Carter Devotes Rest Of Life To Raising Awareness Of Fact That Men Get UTIs Too,"PLAINS, GA'As he continues to rest and recover following a brush with the ailment earlier this week, former President Jimmy Carter announced Thursday he would spend the remainder of his life educating people about the fact that men, too, routinely suffer from urinary tract infections. 'This isn't just an issue that affects women: Every urethra is delicate and susceptible, with roughly one in 10 men contracting a UTI at some point during their life,' said the 39th president of the United States, confirming he would immediately sever ties with Habitat for Humanity and terminate the Carter Center's long-running program to eradicate Guinea worm disease in order to focus solely on the promotion of healthy male urinary tracts. 'This painful affliction is often misdiagnosed, so if you feel a sharp burning sensation when urinating or notice an unfamiliar discharge in your urine, make sure you get tested. It's nothing to be embarrassed about, and there's no reason to live in discomfort when treatment is readily available. They give you some pills and it clears right up.' At press time, Carter was reportedly going from stall door to stall door in a public men's room, where he urged occupants to reduce their risk of a UTI by drinking plenty of fluids and keeping the tip of their penis clean and dry."
193,"Jilted Trump Announces Formation Of Cooler, Way More Powerful NATO With His New Best Friends Oman, Macedonia, And Suriname","LONDON'In response to the covertly recorded footage of European leaders mocking the U.S. president, a jilted Donald Trump announced Wednesday the official formation of a cooler, way more powerful NATO with his new best friends Oman, Macedonia, and Suriname. 'We are going to have so much fun without you losers,' said the U.S. commander in chief of the impromptu new intergovernmental alliance he formed after proclaiming that 'the old NATO is stupid,' explaining that he had already poured billions of dollars of funding into the collective to ensure they have the 'best summit ever.' 'France and Canada think they're so cool, but we could totally destroy them in a fight. I already met with Qaboos, Stevo, and Dsi, and we're gonna get matching satin jackets and they're gonna look sick.' At press time, Trump was already threatening to pull out of his newly formed alliance after accusing its members of not paying their fair share of the budget."
194,Pros And Cons Of Talking Politics At Work,"It's long been taboo to discuss politics in the workplace, and as the national atmosphere becomes more politically charged, arguments have grown both for and against bringing political discussions to professional settings. The Onion looks at the pros and cons of talking politics at work. Anything to kill a half hour. Important to know who you'd help during an emergency. Could use second set of eyes on manifesto. Less heated than talking about new Star Wars. It's what MSNBC is paying you $7 million annually to do. Finally got your echo chamber just how you like it. Oof, Steven's a libertarian. Could interfere with public image of Supreme Court as nonpartisan. Boss casually asking if we think Obama from Kenya already more than enough. Can't afford to lose this job too."
195,One-Eyed Man Who Kamala Harris Locked Up 25 Years Ago Quietly Removes Tulsi Gabbard Mask,"KAPOLEI, HI'Wiping the sweat from his brow and contemplating his long road to vengeance, one-eyed man Calvin Simmons, who was locked up by Kamala Harris 25 years ago, quietly removed his Tulsi Gabbard mask Tuesday after learning that the California senator had dropped out of the presidential race. 'The day she locked me up for marijuana possession, I looked her in the eye and swore I would have my revenge,' said Simmons, rubbing the long scar on his head while staring into the dark, empty room around him and ruminating on how his lifelong quest to destroy Harris's presidential ambitions was finally complete. 'Fifteen years of my life gone'you took them from me Kamala, but it looks like I've had the last laugh. All those lost days in prison, plotting my return, crafting my backstory, studying you for weaknesses, I even joined the army, it's all lead to this. You thought you were tough, you thought you had destroyed me, but your chickens have come home to roost. He nani, Kamala.' At press time, Simmons had taken Gabbard's remaining campaign funds and fled the country to begin a new life in Micronesia."
196,Kamala Harris Supporter Insists Her Inspiring Message Of Something Or Other Will Always Live On,
197,"Michael Bloomberg Treats Self To Second, Flashier Presidential Campaign","NEW YORK'Explaining that he felt he had earned a little indulgence, Democratic candidate Michael Bloomberg confirmed Tuesday that he had decided to treat himself to a second, flashier presidential campaign. 'Having one presidential campaign is nice and all, but I had some extra money lying around and decided to splurge on another first-class presidential campaign with all the bells and whistles,' said Bloomberg, adding that he planned to split time between his original campaign and his new luxury one, for which he'd already gotten the most expensive consultants, most luxurious campaign vehicles, and nicest website money can buy. 'I know I don't really need a second campaign, and it hasn't even been that long since I bought my first one, but it's the holidays, and I wanted to do something special for Mikey. It's going to have a full campaign staff available around the clock, and there's even going to be a movie theater in the headquarters where we can watch all my political ads. Voters are going to be blown away when they see it.' Bloomberg told reporters that he was also scouting sites for an additional international presidential campaign in a more exotic locale."
198,Nation Calls For Letting Biden Rub Women's Shoulders Again After Seeing What He'll Do Instead,"WASHINGTON'Apologizing for what they have unleashed by condemning the former Vice President's past behavior, the U.S. populace issued a call Monday to let Joe Biden rub women's shoulders again after seeing what he will do instead. 'It's not that the shoulder rub thing isn't creepy, it is, but we didn't realize the Pandora's box that we opened by making him stop,' said Loveland, Colorado resident Virginia Dalton, claiming that while Biden smelling a woman's hair had always grossed her out, seeing the 77-year-old biting his wife's finger during a campaign event over the weekend shook her to the core. 'It's fine, just let him do it. Unsolicited shoulder rubs or touching a stranger's lower back are not good, but at least they're kind of normal. There is apparently no hope of him just acting okay, so let's at least give him back the shoulder rubs, because God knows what horrors he will unleash upon women without that outlet.' At press time, the nation's women were hastily promising Biden they would vote for him just so they could escape his advances."
199,Pete Buttigieg Admits Only Recently Realizing Black People Can Vote,"SOUTH BEND, IN'In response to recent criticism of his campaign and political record, Democratic presidential candidate Pete Buttigieg admitted Monday that he only recently realized that black people can vote. 'I'll be the first one to acknowledge that I've had some blind spots in my political career, and I've learned some hard truths over the past few months, one of which is that African Americans have been able to vote in this country for decades,' said the mayor of South Bend, IN, apologizing to the city's black residents for his lack of attention to the problems facing their community and his belief that they didn't possess the legal right to cast a ballot for any elected office. 'In the time since I announced my campaign, my eyes have been opened to the realities of this country's systemic racism, and also black suffrage. I realize that some of the things I've done as mayor and said on the campaign trail aren't going to play as well with this constituency, although, to be fair, I've only just realized that they're a constituency. I honestly had no idea. But going forward, my message to black Americans is that I want your vote now that I know that you have one.' Buttigieg added that in order to avoid alienating potential supporters, he would be open to not letting black people vote. "
200,And Then Those 12 People Send It To 12 People'That's 144 People!' Says Cory Booker Describing Campaign Newsletter Strategy To Rosario Dawson,"NEWARK'Referring to the 'surefire' system as a sort of pyramid of communication, Democratic presidential candidate Cory Booker excitedly walked long-term girlfriend and actress Rosario Dawson through his new network-based strategy to distribute campaign newsletters, sources confirmed Monday. 'And then when those people share it, the 144 turns into over 20,000 people reading, and by the end of the month? That's the whole country!' said a wild-eyed, energized Booker as he paced in front of Dawson, who told the New Jersey senator through a tight smile that it sounded like a great idea. 'Ever since we had to cut staff in New Hampshire, my brain's just been working overtime. I can't believe how easy it is! The trick is to get a teacher or something to email it to parents of the kids, then you're really cooking. It'd be great if a certain actress, who must know 12 people, could endorse me.' At press time, Booker was seen trying to convince Dawson to let him use her garage for an envelope-stuffing party later that week."
201,"Well Spoken, My Good Fellow, But Let Me Retort,' Says Congressman Engaged In Probing, High-Minded Debate On Facts And Merits Of Impeachment","WASHINGTON'Praising the eloquence and noble character of his Democratic colleague before humbly offering a rebuttal, Rep. Jim Jordan (R-OH) engaged in thoughtful and enlightened debate Thursday over the merits of proposed impeachment articles brought against the president of the United States. 'Allow me first to congratulate you upon your exceptional oratory and remark upon what a great honor it is to deliberate this matter with a man of such high integrity,' said Jordan, who addressed House Judiciary Committee chairman Jerry Nadler (D-NY) in measured and courtesy tones, commending civil discourse as the bedrock of a democratic society. 'Although you have made some very cogent and incisive rhetorical points this morning, I must, unfortunately, submit a rejoinder in which I shall seek to elucidate what I believe to be a fallacy in your position. Despite our arrival at this occasion of discord, please know I consider you a true compatriot: a fellow truth-seeker with no interest beyond securing what is best for our great republic.' At press time, witnesses confirmed Jordan had nearly beaten Nadler to death with a cane after being set off by a remark impugning the honor of the president."
202,Fox News Condemns 2020 Election As Partisan Witch Hunt Orchestrated By Democrats To Unseat President,"NEW YORK'Calling the running and nomination of a candidate a blatant abuse of power from the left, Fox News personality Tucker Carlson condemned the 2020 election Thursday as a partisan witch hunt orchestrated by Democrats to unseat President Trump. 'This is nothing more than a Soviet-style democratic election,' said Carlson, adding that the timing of the election was especially suspicious, coming after Trump has already been in office for three years. 'The millions of dollars spent on campaign ads and televised debates clearly point to some larger conspiracy being pushed by the left; it's a total coup! This poorly executed attempt to downplay the president's overwhelming electoral victory in 2016 with some sort of flimsy pretext to democracy is inexcusable and the exact type of threat our founding fathers warned us about. Frankly, it's unconstitutional and shameful to see Democrats stoop to such low levels.' At press time, Democratic candidates had announced the suspension of their campaigns saying this kind of divisiveness was not what America needs right now. "
203,Pros And Cons Of Social Media Banning Political Ads,"Twitter recently announced a ban on political advertising, adding fuel to the debate of whether social media should allow campaign ads and how claims made in those ads might be regulated. The Onion looks at the pros and cons of social media banning political ads. Encourages candidates to exploit more traditional forms of media.  Quite clearly opposite of what Mark Zuckerberg wants. Politicians still free to post thirst traps on personal accounts. Look on Hillary Clinton's face if we started that now. All that personal data collected for nothing. Got few extra Twitter followers from dunking on Biden campaign slogan. Lack of politics is a political statement, man. Having to watch these psychopaths try to do normal-person stuff on Instagram instead.  "
204,,
205,Trump Offers Hunter Biden Job In Energy Department Based On Oil Industry Experience,"WASHINGTON'Touting his impressive record of serving on the board of a notable natural gas company, President Donald Trump offered Hunter Biden a job in the U.S. Department of Energy Monday based on his experience in the oil industry. 'Given his unparalleled background in this sector, I am pleased to have Hunter Biden joining the Energy Department as the new Deputy Secretary for the Office of International Affairs,' said Trump, explaining that Biden's long list of contacts with major Eastern European petroleum firms would be indispensable in promoting the administration's interests as they pursue energy contracts abroad. 'Hunter grew up in politics, so he's primed for the job, and he came very highly recommended by several big-time energy executives. He's a really great guy who knows how to get things done in this business. Hunter will start tomorrow, getting right to work securing the best deals possible for the American people.' At press time, Trump nominated Hunter Biden to replace a retiring Rick Perry as energy secretary at the end of the year."
206,So-Called Ronald Reagan Presidential Library Looks Nothing Like Him,"SIMI VALLEY, CA'Declaring the whole visit 'sort of a letdown,' Valley View Middle School student Lucas Hursch, 13, was disappointed to find Monday that the so-called Ronald Reagan Presidential Library bears no resemblance to the man who was the leader of the free world from 1980 to 1988. 'You could maybe argue it has a passing resemblance from some angles, but seriously, that would be quite a stretch,' said the eighth-grader, adding that unless the 40th president had a tiny, marble version of himself inside his own body which he charged a $20 entrance fee to see, the building bearing his name shares no physical characteristics to the actor-turned-politician. 'I assumed we'd get there, enter a giant glass and steel model of Reagan's head, perhaps using The Great Communicator's tongue as a walkway, and have the chance to explore his guts and stuff. But this place has none of that' just a boring building with completely normal doors and windows. I was taught a library is where knowledge is kept, so that kind of should be up in his brain, I guess? Also, you'd think they have it dressed up in a nice suit or something, but the outside is just bricks. If they were going for realism, they did not do a great job.' Hursch noted that the architects and building contractors had no excuse for their shoddy work, as there are thousands of photographs available to aid them in constructing a more realistic replica of the president. "
207,Pete Buttigieg Blames Inability To Disclose Political Stances On NDA With Buttigieg Campaign,"CONCORD, NH'Declaring that he simply has no choice in the matter, White House hopeful Pete Buttigieg told reporters Friday that some political positions he holds cannot be disclosed because of a nondisclosure agreement he signed with the Pete Buttigieg presidential campaign. 'I would love to answer your questions, but back in early 2019, I signed a strict, binding contract with the Pete for America organization in which I agreed not to discuss such matters,' Buttigieg said during a candidate forum, explaining that while he would love to offer more detailed and convincing proposals on issues such as healthcare, foreign policy, and immigration, he is legally prohibited from doing so. 'There's nothing I'd enjoy more than elaborating on my tax plan, for example, but I can't talk about any views I may have held during the period of my candidacy. These are highly confidential policy initiatives. Unless the Buttigieg campaign agrees to release me from the NDA, I'm afraid there's simply nothing I can do.' At press time, the Buttigieg campaign was reportedly scrambling to perform damage control after details of Buttigieg's political stances had been leaked to the public."
208,Trump Orders National Christmas Tree Be Cut To One Inch Shorter Than He Is,
209,Matt Gaetz Solemnly Raises Pistol To Head After Realizing He Used Barron Trump's Name While Scolding Witness For Using Barron Trump's Name,
210,Sonny Perdue Argues Food Stamp Cuts Will Incentivize People To Get Exploitative Jobs That Won't Exist In 5 Years,"WASHINGTON'Responding to the criticism surrounding the Trump administration's recent decision to tighten restrictions on supplemental nutrition eligibility, Secretary of Agriculture Sonny Perdue argued Thursday that the food stamp cuts will incentivize people to go out and get exploitative jobs that won't exist in five years. 'Look, these cuts are not about kicking people off the food stamp rolls, but encouraging them to get off the couch and start looking for thankless, backbreaking work that will be rendered obsolete by either automation or outsourcing by 2025,' said Perdue, adding that the administration's goal wasn't to prevent Americans from affording food, but to create an empowering situation where U.S. citizens could barely have the means for sustenance because their degrading, short-term job, with severe physical and emotional hazards, forces them to work overtime without extra pay. 'We are hoping the new directive will serve as a gentle nudge for Americans to take their lives into their own hands by signing up for one, two, or even three demanding jobs from a hellish megacorporation that only cares about their bottom line. People shouldn't be relying on the government for free food, especially in this current Trump economy'there are tons of available positions that will push the boundaries of their physical and mental health, as well as significantly decrease their life expectancy, all in exchange for a meager subsistence that robs them and their families of their dignity.' Perdue also added that the new rules would work in tandem with the proposed cuts to Medicare, which the administration has argued will incentivize unemployed people to take up jobs that offer inhumane health care plans that don't cover essential services."
211,Boris Johnson Worried Anti-Semitism Accusations Against Labour Party Will Hurt Tories' Hold On Bigot Vote,"LONDON'Monitoring polls and news coverage of the upcoming elections, U.K. prime minister Boris Johnson reportedly expressed concern Thursday that continued accusations of anti-Semitism against the Labour Party will hurt the Tories' hold on the bigot vote. 'Those with prejudiced and discriminatory beliefs have long been a bedrock of the Conservative Party constituency, but I'm nervous that so many people attacking Labour as the party of anti-Semites will eat into our ability to win,' said Johnson, adding that he was concerned the volume of allegations that Labour Party leader Jeremy Corbyn wasn't doing enough to combat anti-Semitism in his own party could result in bigoted voters believing that Labour actually represented their values. 'When allegations first started coming out, I figured it would be a flash in the pan and the Tories could continue counting on the bigot vote, as we have for generations. It's really going to hurt us if people think Labour is the party for anti-Semitism based on a few things in the media and ignore the political reality, which is that the Conservatives have for decades reliably issued policy driven by prejudice and racial animus. But it's going to be a close election, and I'm worried if this doesn't stop, the Tories could be at risk of losing the Islamaphobe or even the white supremacist vote, and that would be devastating at the polls.' An increasingly desperate Johnson added that he was pondering saying or doing something extremely anti-Semitic in order to remind bigoted voters on the fence about which party best advocated their interests."
