,Headline,Body text
142,Liberals Say Sanders's Acceptance Of Rogan Endorsement Sends Dangerous Message He Trying To Win Election,"WASHINGTON'Slamming the campaign for promoting the popular podcaster's backing, liberals said Friday that Bernie Sanders's acceptance of Joe Rogan's endorsement sends a dangerous message that the candidate is trying to win the 2020 presidential election. 'This is just the Sanders campaign opening the gates to a plurality of people who would vote for him and help him win the presidency,' said political commentator Scott Griffin, who called the campaign's promotion of Rogan's endorsement a true 'mask off' moment, exposing Sanders's goal of winning the Democratic primary and eventually the general election. 'It's very unnerving to see a Democratic candidate like Bernie Sanders try to court voters from varying constituencies and demographics. It's like his whole strategy is beating Trump. We saw hints of this in 2016, but I'm truly sickened to see it rearing its ugly head again. I'm all for creating a Democratic majority, but not if we have to accept more people than the other side has.' Griffin added that it was even more disturbing that Sanders would attempt this during an election year."
143,Melting Giraffe Congressman Warns Impeachment Distracting From Surreal Issues,"WASHINGTON'Arguing that a protracted congressional trial wasn't in the best interests of everyday floating nude Americans, melting giraffe congressman Fauna Anuaf reportedly warned Friday that focusing on the impeachment of President Donald Trump was distracting from the surreal issues. 'When there are so many people in this country imprisoned inside two-dimensional towers or struggling with their legs turning into water, we cannot let ourselves get caught up in a biased proceeding that does nothing to address the surreal problems many Americans face,' said the melting giraffe congressman (E-EEE), adding that in his district, residents were worried about biomorphic trains materializing through their walls, orca whales trapped in bottles on an endless desert landscape, or being flayed on a fainting couch while three heads in bowler hats screamed that their body is a chorus of bodies diffusing under the heat of time itself, not some court proceeding. 'The moment my constituents poured candle wax into the endless thermometer to elect me to Congress, I took their wailing approval as a solemn reminder to keep focused on the surreal issues. At every town hall back in my inverted ether, my constituents come to slice my eyeball, which I understand as a sign that impeachment doesn't enjoy broad support. And we need to stop this partisan bickering'I didn't swear an oath to be a Democrat or Republican; I swore an o"
144,Trump Makes Powerful Pro-Life Case By Speaking About The Joys Of Neglecting A Child,"WASHINGTON'Speaking to thousands of March For Life protesters assembled on the National Mall, President Donald Trump took to the stage Friday to make a powerful pro-life case about the joys of neglecting a child. 'Of course, I'm a father, and I had my thoughts about terminating them all, but I'm standing before you today to tell you that I'm glad I didn't because I would never have gotten to experience the simple but incredible pleasures of pawning them off on the help for the first decade or so of their lives,' said Trump, defending the anti-abortion movement with a stirring speech about how profoundly being an absent and indifferent father had affected his life. 'I wish I could describe to you how good it feels to avoid every soccer game and piano recital, and how incredible it's been watching them grow from a child I couldn't care less about to an adult I barely know. Whether it's Ivanka, Don Jr., or one of the other two, they've each been a blessing that I never would have known if they had been aborted.' Trump went on to bring several audience members to tears by describing in detail the moment he first realized he'd be able to bully and emotionally terrorize his children forever. "
145,Trump Woos March For Life Crowd By Kissing Supporter's Unborn Baby,
146,Trump Lifts Obama-Era Protections Trapping Gangthor The Malevolent In Tomb Deep Within Murky Depths Of Pacific Ocean,"WASHINGTON'Denouncing his predecessor's water regulations as overly restrictive, President Donald Trump announced Thursday he was lifting protections enacted by the Obama administration to permanently entomb Gangthor the Malevolent in a murky trench deep below the Pacific Ocean. 'These horrible rules created by Barack Obama are one of the worst examples of government overreach in our nation's history, and they are totally unfair to the deadly leviathan known as Gangthor,' said Trump, who was later overheard muttering ancient incantations reportedly intended to loosen the cursd chains that shackle the nefarious shadow-behemoth to the ocean floor. 'I will personally swim to the bottom of the Pacific and use a golden key inscribed with mysterious runes to unlock Gangthor's lair, where he has slumbered since the destructive Clean Water Rule of 2015 was issued. This shape-shifting, multi-tentacled monster will then once more be unleashed upon the waters of the United States, restoring the property rights of American farmers, fossil fuel companies, and real estate developers.' The president went on to criticize 'prophets of doom' who have predicted Gangthor the Malevolent will rise in a column of smoke and fire upon his release, blocking out the sun and blighting the earth with a thousand years of darkness."
147,Justice Roberts Sternly Admonishes Impeachment Participants To Remember They're At Complete Farce Of A Trial,"WASHINGTON'After he gaveled the Senate to order Wednesday afternoon, Chief Justice John Roberts sternly admonished both President Trump's counsel and House impeachment managers to remember they were participating in a complete farce of a trial. 'As you address members of this deliberative body, please bear in mind that nothing you say or do will have any effect on the completely predetermined outcome of these proceedings,' said Roberts, exhorting the two sides to go ahead and establish facts, promulgate lies, cite the Constitution, or engage in purely cynical bad-faith arguments, because none of it really mattered anyway. 'I wish to remind you this trial is a hollow exercise of decorum with no possibility of achieving productive results of any kind. We're just going through the motions here, we all know how it is going to end, so let's at least try to keep it brief.' At press time, the chief justice had commended both sides for heeding his admonition and working to keep the monumental miscarriage of justice running smoothly."
148,Senate Republicans Force Through Resolution Establishing Wingstop As Official Sponsor Of Impeachment Trial,"WASHINGTON'Over the objections of Democrats who decried the measure as not receiving sufficient debate on the congressional floor, Senate Republicans forced through a resolution Wednesday establishing Wingstop as the official sponsor of President Donald Trump's impeachment trial. 'Resolved that effective immediately, all questions, witness statements, and other utterances must include a recommendation to eat at Wingstop, and the Wingstop logo must be clearly visible on all name placards, subpoenaed documents, and other written material,' read Majority Leader Mitch McConnell (R-KY) from the resolution on the Senate floor, adding that Wingstop's $25 million deal to sponsor the impeachment trial was the best offer Congress received and ignoring pleas from Minority Leader Chuck Schumer (D-NY) to wait for Panera Bread to finalize its proposal. 'This resolution also stipulates that each senator must be photographed with Wingstop's lemon pepper wings on each day of the trial as part of our promotion, all social media posts about the impeachment must be accompanied with the #RightWingstop hashtag, and that the only food permitted in the chamber will be Wingstop wing combos with fries or veggie sticks and a 20-ounce soft drink. This is in order to ensure the impeachment trial remains a place where flavor gets its wings. Democracy works best when we're full of chicken.' The resolution did make an exception, however, for Chief Justice John Roberts, who informed the Senate that the Wingstop contract could not apply to him, as he has an exclusive sponsorship with Buffalo Wild Wings."
149,Contrarian 'New York Times' Travel Section Breaks With Paper To Endorse Deval Patrick For Democratic Nomination,"NEW YORK'In a dramatic challenge of the editorial board, The New York Times travel section broke with the paper Tuesday to endorse former Massachusetts governor Deval Patrick for the Democratic nomination. 'Given his impressive track record as a card-carrying Hyatt Loyalty Program member and the only candidate with TSA PreCheck, we are left no choice but to split with the main body of this organization and endorse Deval Patrick,' said travel editor Amy Virshup, explaining that the section's values have been diverging from the rest of the newspaper for years and that The Time's co-endorsement of Klobuchar and Warren did not reflect the values of American jet-setters nearly as well as Patrick. 'Patrick thoroughly impressed us with his comprehensive plan for the best way to spend 36 hours in Marrakech, and proved he's ready to lead with his extensive knowledge of everything from using concierge services to where to find the best bar in the Seattle area. Whether you prefer a family vacation or a romantic getaway, for the conscientious traveler, there is no better candidate than Deval Patrick.' At press time, an emergent Deval Patrick had picked up endorsements from every major American newspaper's travel section."
150,Kellyanne Conway Suggests Martin Luther King Jr. Would Have Traveled To Ukraine For Dirt On Biden,"WASHINGTON'Praising the civil rights leader for his determination and commitment to justice, Kellyanne Conway, senior counselor to the president, suggested to reporters Monday that Martin Luther King Jr. would have traveled to Ukraine for dirt on Joe Biden. 'Dr. Martin Luther King, who was known for his nonviolent tactics, including protests and community organizing, would certainly have traveled abroad to pressure foreign nations to expose a political enemy's secrets,' said Conway, who explained that if King were alive today, he would without a doubt hop on a flight to Kiev to meet with Ukrainian government officials to acquire potentially damaging information about Biden's younger son, Hunter. 'While much of the United States remains divided, Dr. King had a brave and bold vision hinged on withholding aid from Ukraine for personal political purposes. He understood that civil disobedience is essential in fighting a corrupt system, so he wasn't afraid to spend the night in jail or do a little quid pro quo. In fact, some of his most famous tweets were written from jail.' Conway added that it was a shame such a great civil rights leader had been impeached so young."
151,"They Can't Impeach Someone They Can't See,' Say Trump Boys Cramming Dad Into Homemade Bunker Under Oval Office Desk","WASHINGTON'Hastily concealing the 'super top secret' shelter's entrance with a couch cushion, the Trump boys reportedly declared 'They can't impeach someone they can't see' Friday while cramming their dad into a homemade bunker under the Oval Office desk. 'The House peach managers [sic] are never, ever gonna be able to find dad way deep in here!' said Donald Trump Jr., who stapled a note with the message 'definitely no president inside' to blankets as an extra security precaution while Eric Trump punched air holes through the pillows with a pair of scissors. 'Stay right there, dad, and don't move till 2050. We read through the whole constant tuition [sic] and it says those guys can't impeach you if they can't find you. Here are two pieces of bread for dinners, and a straw you can use as a snorkel. Close your eyes real tight and you'll be totally invisible. Okay, see you later. We're gonna glue the bunker door shut.' At press time, the Trump boys were panicking after realizing they'd lost their father."
152,Underwear-Clad Senators Line Up Before Congressional Doctor To Make Sure They Physically Fit For Impeachment,
153,Republican Senators Maintain They'll Weigh All Evidence Before Carrying Trump Out On Shoulders,"WASHINGTON'Stressing that their duty to uphold the Constitution required impartiality in their role as jurors, Republican senators told reporters Friday that they would weigh all evidence before lifting President Donald Trump into the air and carrying him outside on their shoulders. 'Look, as senators, we swore a solemn oath to deliver justice, and I intend to abide by that precisely as we use this trial to scrutinize the facts and then determine exactly how'and indeed, if'we will storm into the Oval Office, hoist the delighted president aloft, and regale him with spirited rounds of 'Hip, hip, hurray,'' said Sen. Mitch McConnell, noting that his awesome responsibility as the chamber's majority leader required him to tamp down on any partisan speculation on whether Senate Republicans would rush to raise the president up onto their shoulders while singing 'He's A Jolly Good Fellow' or if Senate Republicans would opt for a more stately procession in which they conveyed the recently acquitted Trump past each and every Democratic congressperson's office. 'Unlike some of my liberal colleagues, I understand my solemn role in this trial is to examine all the information at hand before passing judgment. Then, and only then, can we know whether it's a reasonable course of action to deploy some form of red-white-and-blue confetti while repeatedly tossing President Trump into the air. Until then, it would simply be irresponsible to comment on whether or not we will incorporate party horns, noisemakers, or a big cake covered with lit sparklers into the proceedings.' At press time, Democratic Sen. Joe Manchin had commended McConnell on his commitment to impartiality as they came to a swift conclusion on whether or not they should cue up Kool and the Gang's 'Celebration' on the Senate's speaker system."
154,CNN Reveals Bernie Sanders Running For President Of Country With History Of Sexism,"WASHINGTON'Calling their bombshell report incredibly damning, CNN revealed Thursday that Democratic candidate Bernie Sanders has been knowingly running a campaign to become president of a country with a long history of sexism. 'This new evidence proves beyond a doubt that Bernie Sanders strongly wants to lead a nation that has repeatedly enabled, supported, and encouraged misogyny,' said Anderson Cooper in a breaking news segment, claiming to have several documents directly linking Sanders to a country that did not even allow women to vote until the 20th century. 'Right here is a transcript of the text this woman-hating country was founded upon, a country which he willfully lives in and has publicly sworn an oath to, mind you. On just the first page it explicitly declares that all men are created equal, with absolutely no mention of women. And down here'look closely at these signatures that ratified this document as the supreme law of the land. You guessed it, all men.' At press time, CNN confirmed that Sanders had not yet denied his close ties to this country nor its tens of millions of residents with deeply ingrained biases against women."
155,Stephen Miller Hurt At Being Passed Over For Job Stalking Female Ambassador,"WASHINGTON'After learning that Ukraine police had opened an investigation into whether associates of the president had surveilled the diplomat in Kyiv last year, White House senior advisor Stephen Miller was reportedly upset Thursday at being passed over for a job stalking female U.S. ambassador Marie Yovanovitch. 'When I found out that some of Giuliani's goons had been tailing the ambassador around Ukraine, my heart just sank'I mean, how could they decide to follow a lady around and not pick me to do the job?' said Miller, who added that after all the thankless tasks he had performed for the Trump administration over three-plus years in office, he figured he would be at the top of the list when a plum gig like stalking a woman on the administration's behalf came along. 'If I had known there was an opening for shadowing an important lady, I would've absolutely thrown my hat in the ring. Maybe I got passed over because I'm already stalking a bunch of women here in the U.S., but I still would've been able to manage my time and make it work. It really hurts that they didn't even bother to ask. It would be one thing if I didn't have any experience in tracking women without them knowing, but I'm really good at it. I can keep quiet in an alleyway, or stay awake idling in the car, or huddle in a closet without a peep for hours. And I'm really good at gathering hair and undergarments. I just wish they'd given me a chance.' At press time, Miller had decided to cheer himself up by lying below the former ambassador's bed wearing her clothing while she was asleep."
156,CNN Audio Analysis Reveals Biden Caught On Wet Mic While Chewing On Own Microphone,"DES MOINES, IA'Emphasizing that the leaked recording would clear up any confusion about the various crunching, slurping, and gurgling sounds heard after the Iowa Democratic Debate, CNN released a wet mic audio analysis Thursday that revealed Joe Biden had been caught chewing on his own microphone. 'While at first, the recording only picks up Biden shaking hands and joking with his fellow candidates, we eventually hear him tapping on the mic and whispering, 'Oh, what is this? Come to papa,'' said CNN audio engineer Kristen Jennings, adding that the former vice president can then be heard sniffing the lavalier, licking it once, and then sticking it directly into his mouth. 'After hours of analysis, our team has determined that Biden then attempted to chew the mic before saying 'ew' and spitting it out onto the ground. Then, a few minutes later, he decided to pick it back up, pop it back into his mouth, chew it, and ultimately, swallow it.' At press time, CNN confirmed that the microphone's audio had also picked up ample evidence that Biden had successfully passed the mic two days later."
157,,
158,Articles Of Impeachment Sent Through Winding Maze Of Pneumatic Tubes On Journey To Senate,
159,Public Disapproval Of Iran Approach Convinces Trump To Reverse Soleimani Killing,"WASHINGTON'Backtracking in light of recent polls that indicate public dismay over his handling of Iran, President Trump announced Wednesday he was moving forward with a plan to reverse the killing of top Iranian general Qassem Soleimani. 'I have overturned the decision to assassinate Gen. Soleimani and ordered our military to rescind the Jan. 3 drone strike that destroyed his convoy at Baghdad International Airport,' said Trump, who explained the move would revoke Soleimani's status as a Shiite martyr and decrease the likelihood of the United States being drawn into an unpopular war with Iran. 'The U.S. Air Force operation that killed the general was conducted without the consent of Congress and, more significantly, without the backing of the American people. So today our forces in the region will take immediate action to return Soleimani to his family unexploded. This doesn't mean we won't take him out in a future operation if surveys indicate a majority of swing-state voters approve of such an action, but for now we will allow him to resume command of the Quds Force.' The president added that he has yet to see any polls that would convince him to retract his October decision to let Turkey kill hundreds of Kurdish civilians in Syria."
160,Biden Asks Advisors How Much Longer He Has To Pretend To Be Confused And Doddering To Avoid Criticism,"DES MOINES, IA'Cutting off his chief strategist midway through a daily meeting to express his unwillingness to continue the deception much longer, former Vice President Joe Biden reportedly asked advisors Wednesday how much longer he has to go through the routine of acting confused and doddering in order to avoid criticism. 'Please, guys, I'm so tired of putting on this whole song-and-dance of stumbling over my words at every public appearance and painfully wincing so it seems like I've completely forgotten a foreign leader's name,' said the presumptive frontrunner, looking at each and every one of his advisors with clear, thoughtful eye contact, while stressing that although his consistent lead in polling showed the strategy had worked spectacularly to shield him from any critique of his record, he also longed to drop this 'entire frail-old-man act' and speak to audiences in full sentences that allowed him to robustly articulate his vision for restoring America's soul. 'Just give me a date when I can start fully enunciating my words in TV spots. That's all. Obviously, I can keep doing the simple stuff like biting my wife's finger or challenging audience members to push-up contests seemingly out of nowhere. I know you think that's helpful. I get that it would sink me in the polls if I were held accountable for past statements and actions, but frankly it's just exhausting to be constantly acting this mentally confused when I know I can be so much stronger out there.' At press time, Biden was begging his advisors to at least never again make him punch himself midway through a debate to give the appearance of his eye filling up with blood."
161,Pros And Cons Of Economic Sanctions,"Economic sanctions, in which a country levies financial penalties against another country, entity, or person, are at the center of tense U.S.'Iran relations, and their use in general is a matter of significant debate. The Onion looks at the pros and cons of economic sanctions. Something to say you tried before starting the war you were planning anyway. Shows populace consequences for insisting on being born powerless in dictatorship. More difficult to quantify deaths they cause than straight-up war. Just nice to have something to announce every once in a while. Only harms people without power to retaliate. Innocent money drawn into other parties' conflict. Probably involve at least some math. Damn it. We wanted to travel there one day. Shit. Denies thousands of citizens sweet taste of Pepsi Max. Not as satisfying to invade country whose citizens already sick and starving to death."
162,Pete Buttigieg Trapped In Freezer After Searching Iowa Diner For Back Room With High-Rolling Donors,"BETTENDORF, IOWA'Shivering and shouting for help as his plan to find his supporters went awry, presidential candidate Pete Buttigieg was reportedly trapped in a walk-in freezer Thursday after searching an Iowa diner for its back room with high-rolling donors. 'Help! Help! Can anyone hear me? I don't understand where my donors are if they're not in this cooler,' said Buttigieg, who had reportedly breezed through the diner, ignoring its clientele, before asking a line cook where the back room with all the wealthy campaign funders was located, getting frustrated at the man's confusion, and deciding to find it himself by searching for a hidden passageway as the freezer door locked behind him. 'I don't understand'it's usually right here. They have to hide in the back so we can meet in secret outside the prying eyes of the media and all the poor people. Where is the manager? Why on earth would I enter a rinky-dink joint just to hobnob with a bunch of people eating scrambled eggs and getting five bucks for my trouble when I know there's a cushy hidden back room where I can talk to voters who matter over a glass of champagne? Jesus Christ, where's [spokesperson] Lis [Smith] when I need her? I don't know what I'm going to do. I already called for help in eight languages, and I'm starting to get really cold.' At press time, Buttigieg had resorted to doing his campaign's 'High Hopes' dance in an effort to stay warm."
163,CNN Reminds Debate Participants To Keep Personal Attacks Off The Stage In Favor Of New Confession Cam Backstage,"DES MOINES, IA'Reaffirming their commitment to facilitating a civil, constructive event, CNN moderators reminded Democratic debate participants Tuesday to keep personal attacks off the stage in favor of the new confessional cam backstage. 'We want to have an honest discussion about policies and positions, so if you have any vicious insults or cheap shots you want to take, we ask that you hold back until we have you mic'd up and sitting somewhere cushy,' said moderator Wolf Blitzer, who added that in the offhand chance candidates didn't have anything negative to say, a CNN producer would be able to assist them by offering them a glass of champagne or shot of tequila and some helpful prompts. 'Verbal abuse will not be tolerated on the debate stage, but if you want to call Pete Buttigieg a spineless little bitch in front of the confession cam, we ask that you please go off. Voters have an important choice to make, so we ask that you let any unpleasant feelings build up inside of you until you have the opportunity to get backstage and explode. Crying for an hour and then falling asleep in front of the confession cam is simply standard debate etiquette.' Blitzer added that the footage would be shared in a two-hour-long special following the debate."
