,Headline,Body text,Meta Tags
211,Saturday Looks Terrible for Busy Executive,"CLEARWATER, FL (AP)' Ac-cording to a published report, this coming Saturday, which was expected to look good, now looks terrible for area resident Walter Russell. A marketing executive with the firm of LaMont, Holland & Dozier, the 38-year-old Russell was expected to be free some of the day, but will in reality be extremely busy from early morning until late evening, his time occupied with important business-related matters. ' Saturday' s terrible for me,'  Russell said to friend Jack Shores when asked if he was interested in playing golf that afternoon. ' I' ve still got to figure out the preliminary numbers on the Jenn-Air account before the proposal Monday, and I haven' t even seen the darn strategy report.'  Shores, a fellow marketing executive, expressed disappointment over Russell' s unavailability for golfing. ' I was really looking forward to playing a round with Walter,'  Shores said. ' He' s the only one in the office I can actually beat.'  Shores then chuckled and made several more humorous remarks about his friend' s questionable golf skills. Also disappointed with Russell' s busy Saturday schedule is mistress Diane Kane, 31, with whom the married Russell has been having an affair for nearly four years. ' We were supposed to go out to dinner, and then take a late-night cruise,'  Kane said. ' I was even going to call him by his pet name, ' Waltie,'  which drives him crazy.'  ' I' m sorry baby,'  Russell told Kane late last night via phone. ' I' m just slammed tomorrow. I promise I' ll make it up to you soon.'  Russell then added he would ' really make it up to her,'  if she knew what he meant. This Saturday will mark the third terrible one this month for Russell, who last weekend had to pass on lunch with his wife to finish outlining final budget initiatives for the Mopar Auto Parts account. Experts are not surprised Russell is so busy Saturday. ' Unlike your average auto mechanic or schoolteacher, important marketing executives often must sacrifice weekends,'  Professor James J. Dilweg of Pennsylvania' s Wharton School of Business said. ' Clearly, Walter Russell understands that to stay on top in a competitive, ever-changing business environment, one must give 110 percent. It is such passion for perfection that defines a winner.'  There is an outside shot Saturday will be okay, if Russell can get a solid enough draft of the report done by mid-afternoon. If that happens, he will try to catch the second half of his son' s youth league basketball game before stopping at a client' s early evening cocktail party. He also has been putting off a tune-up for his 1993 Lexus, which at 30,000 miles is starting to give him the type of problems he thought he could avoid by purchasing a $44,000 car.","business, archive, news, vol 29 issue 03, the onion"
212,Middle-Class Suburbanites Fail to See Irony in Their Lives,"Princeton University' s renowned Institute for Advanced Studies revealed yesterday that the middle class, known to French social theorists as the ' petit-bourgeoisie,'  failed in over 98 percent of measured cases to notice the inherent irony in their lives. Though their very existences are riddled with the exact opposites of intended meanings that define irony as we know it, the middle class roundly failed to notice it in a barrage of tests conducted over the past six months by IAS. ' There are countless examples of irony evident in the lives of suburban consumerism-based nuclear families,'  Institute spokesperson Jody Clewes said. ' These ironies, however, are totally lost on the fatuous, unthinking middle class.'  The IAS released over 75 sample questions and answers to demonstrate its findings, ranging from irony evident in social and political agendas, all the way to personal lifestyle choices. Most striking was the middle class' s predominant self-definition as ' socially liberal,'  with regard to equal civil rights and fair treatment for society' s impoverished. This stood in marked contrast to the middle class' s recent trend toward gated, exclusive communities as well as voting for lower property taxes in high-income areas and higher taxes for those living in low-income communities with racially exclusive public schools. Of those polled, 100 percent saw no irony in this. Similarly, the suburbanites were asked if the frequently cited justification of ' wanting to provide my children with a better life'  stood in contrast to working seven days a week to accumulate money. Despite the ever-widening gap between parents and children, and the skyrocketing divorce rate resultant from a lifestyle focused not on family but on careers, all those polled responded, ' I have no idea what you' re talking about.'  As for middle-class suburban lifestyle, there was a similar lack of ' irony recognition'  among the respondents. When quizzed about the familiar practice of ' saving money'  by purchasing retail items ' on sale,'  when the items are not needed even under non-sale conditions, only one of the 68 housewives polled reported noticing slight irony. It was later confirmed that the woman had recently been ' chewed out'  by her husband for spending too much on extravagant, fashionable hats. ' What we' re seeing here,'  UCLA sociologist T. Hubbard Meyer said, ' is that these people sincerely do not see how absurdly comic and borderline pathetic their lives are. Of course, as part of academe, I live on campus and do not have to deal with such societal trifles.'  Middle-class Americans also failed to see the irony in avoiding physical activity by driving everywhere and using elevators instead of stairs, and then joining an expensive health club. The study also queried the logic of drinking diet soda for health reasons, despite the fact that soda is universally defined as a non-healthy ' sweet,'  with ' diet'  merely representing a lower-calorie version of soda with no inherent nutritional value. With regard to pet ownership, the middle class frequently spends hundreds if not thousands of dollars on purebred animals, when healthy, free pets are available at most pounds and humane societies. When approached with this irony, respondents answered with a universal, ' Duh?'  Two rare exceptions in the study were a pair of middle-management employees in their 50s who had suffered psychological breakdowns and were hospitalized after bungled suicide attempts. Their answers noted high degrees of irony in all aspects of their lives, though each survey they submitted included a note from their wives asking, ' Please, pay no attention to my husband, he is not well.'  One respondent, when interviewed for this story, was more than willing to share his take on the survey. ' IronyE€¦ Now let' s see, I seem to recall something about the importance of not mistaking irony for sarcasm in an essay in the NYROB I read recently,'  Gus Freen, 51, said. ' If you' ll have a seat, I' m sure I can dig it up in the library. Irony, was it? Here, would you like a gin and tonic while you wait? I see you' ve noticed my Civil War Memorial Chess Set. Well, the Franklin Mint is known for its exquisite, hand-crafted workmanship.'  The sample group used for the study, residing within a carefully chosen four-block radius located in residen","local, archive, archive, vol 29 issue 02, local"
213,NASA Nears Completion of $80 Trillion Earth Sock,"Amid much fanfare, NASA officials unveiled the first satellite photos of the nearly completed Earth Sock yesterday at Cape Canaveral. The mood among attending scientists, who have spent the last quarter century working on the project, was one of deep joy, as the result of the ambitious $80 trillion project was finally in sight. ' The now-depleted world econ-omies can rest assured that the $80 trillion price tag will buy a lot of snug-fitting comfort and support,'  Project Earth Sock coordinator Noam Gekhend said. Officials credit the Sock' s completion to the unprecedented international cooperation the project inspired, including astronauts and knitters from over 60 nations. Scores of sock construction teams, both aground and in space, maneuvered fleets of Darning Convoys and Knitting Shuttles in complex flying patterns to weave the freight-train-sized strands of cotton fiber into the 90,000 mile-long Sock. The Earth Sock is the largest man-made structure ever built, dwarfing its nearest competitor, the Great Wall of China, by a factor of two million. It is also cushiony and 100 percent cotton, which means it' s breathable. NASA scientists ex-plained that the Earth Sock will provide the Earth with much-needed protection against chafing and discomfort as the planet is propelled around the sun at 1,800 miles per hour. ' Imagine walking 1,800 miles an hour in the minus 260-degree cold of outer space without socks on,'  Gekhend said. ' To do so would be foolhardy. This is what our planet must do every day. Finally, we have done something to protect her.'  International support for the Sock has been overwhelming. ' As a nation, as a planet, we can all be very proud of this sock,'  President Clinton said. He and the leaders of all 178 nations on earth signed a world resolution proclaiming the completion date, January 1, 1997, ' Sock Day.'  Singing sensation Neil Diamond has soared to the top of the adult contemporary music charts with a tribute song to the Earth Sock: Earth Sock / Mighty Earth Sock! / You' re in outer space / With you we can win this crazy race / And wherever you go / We will go with you / In our minds / In our hearts / And in our dreams. Despite the project' s widespread popularity, some naysayers fault the Sock for being a meaningless make-work project that will devastate the world economy and destroy its delicate ecosystems. Another drawback of the Sock has been the obliteration of the Southern Hemisphere, smothered under the enormous pressure of the snug-fitting sock. The continents of Africa, Australia and South America now exist only in white cotton relief, their citizens unable to stand up or breathe, inexorably pushed downward by the enormous Earth Sock. ' My family and my farm, everything I had, was crushed under the Sock,'  said Pasqual Perquoyez, a Peruvian farmer. ' Why was my country forced into poverty to pay for this Sock?'  A lucky few, such as Perquoyez, have managed to squirm out of the Earth Sock through periodic gaps in the breathable, double-knit fabric. But life for such survivors is hard. Their world is an endless white cotton hellscape, the ghostly shapes of buried cities, mountains and loved ones underfoot. ' The destruction of the Southern Hemisphere was unfortunate,'  Earth Sock project coordinator Gekhend said. ' But realize that the loss of half the planet' s population is well offset by the Sock' s cushiony comfort and at-trac-tive ' crew'  style.'  Gekhend as-sured the world community that no nations of im-port were smothered by the Earth Sock, only minor Southern Hemi-sphere countries like Uruguay, Na-mibia and New Zealand. Scientists also warn that the tip of the sock may come dangerously close to the sun' s corona at the vernal equinox (when the earth is closest to the sun), which may cause the dry fabric to catch ablaze. ' Such a fire would quickly engulf the sock and light up the entire planet Earth like a roman candle in a matter of seconds, reducing every plant, animal and mineral into white hot ash, and cause the planet to break up into a fine dust and dissipate into outer space,'  Gekhend said. ' We' ll know for sure by late Feb-ruary.'  Despite its stag-gering scale, the Earth Sock is only the beginning. ' It is merely a precursor to the Earth Shoe, which we will begin constructing in 2002,'  Gekhend said. Coordinators say the Shoe project will commence once the Earth Sock is pulled up over the entire Earth surface, allowing for an easy and comfortable fit in the shoe.","archive, archive, vol 29 issue 02, the onion"
214,Corporate Merger Results in Global Headshop Conglomerate,"AUSTIN, TX' Since the 1970s, ' Bong on a Drum'  and ' Party Hopper'  have been competitors, offering high-quality decorative smoking pipes, tie-dyed T-shirts and multi-purpose nitrous-oxide dispensers. This week, they will merge, an action that could result in a global conglomerate offering franchises in hundreds of world markets, a listing on the New York Stock Exchange, and salaries in the tens of millions for its two CEOs. ' Yeah, we decided to go into business together because I got this problem getting up in the morning,'  Selena Jones, CEO of Party Hoppers, said. ' I almost never open my store before 1 p.m.'  Jones and Bong on a Drum owner, ' Tobe,'  had planned to get together earlier this week with a group of Wall Street investors to discuss their venture, but Tobe had not shown up for the meeting, and failed to call Jones beforehand. ' That' s cool,'  Jones said. ' Because I was completely out of it, and nobody else showed.'  London Financial Times reporter Berhard L. Timmons has monitored the efforts of the two shop owners closely. ' The floor of the Board of Trade is abuzz with talk of Jones and Tobe' s plan,'  he said. ' Hand-tooled pipe and incense-holder futures are historically skittish in the crucial first quarter' this could be the move that sends them through the roof.'  Jones and Tobe have missed the last three weeks of trading sessions because they were high. The two business leaders believe they can network instead at an upcoming hemp rally. There they may connect with a low-cost overseas fluorescent poster distributor whom Jones has heard will be in attendance. A partnership with this party will lower their collective overhead and give them the capital to back even larger, international expansion. ' It would be cool,'  Jones said, ' but if we had a shitload of stores, I' d have to make tons more bead curtains, and I don' t know if I could handle that.'  Their hope is eventually to sign a multi-million dollar licensing agreement to streamline and systemize production of items such as hand-painted drums, decorative pipes and one-of-a-kind bronze candle holders. To accomplish this goal, they need just one thing: ' I think we might need to write some kind of business proposal,'  Tobe said. ' I heard that you might need one of those to, like, show to people so they know you are a serious businessman.'  The entrepreneurs will carry out their plan as soon as they can locate Mitch, a third-year law student who once played in a band with Jones. They believe he can help them write any corporate documents necessary for their venture. One worry that could slow their ambitious corporate rise is that Mitch may have moved. ' I gotta find that dude' s phone number,'  Jones said. ' I hope he' s still living at that same place.'  Added Tobe: ' Yeah, if we find him, he' ll totally hook us up, because he always did us favors before and we used to get stoned together.' ","local, archive, news, vol 29 issue 02, local"
215,"Enraged Gorilla Beats, Maims Luggage Manufacturer","Still furious over his inability to inflict damage upon numerous pieces of high-quality Samsonite luggage many years ago, Bobo the Gorilla severely pummeled Samsonite CEO Frank Jurgens into a life-threatening coma yesterday. Bobo, a 550-pound African lowland gorilla, became enraged upon seeing the man singularly responsible for the development of the extraodinarily durable, long-lasting luggage. ' It was horrible, just horrible,'  one witness said. ' The gorilla would pick him up, spin him around, and throw him down, then hit him with the luggage. It would set him up against the wall in a half-conscious slump, get a running start from the other side of the room, then smash into him with the suitcase and rebound off the wall. It' d pick him up and spin him around in a pinwheeling motion, then throw him at the floor and bounce him against the wall again. It' d jump on his head, bounce up and down in a squatting motion on his chest, then pick him up and start the whole process again.'  Witnesses reported that the gorilla' s choice of weapon proved especially damaging to his victim, as its rugged, quality construction was able to withstand the most strenuous levels of wear and tear without damage, maintaining its durability as the gorilla repeatedly smashed it into Jurgens' s head, neck, chest and back. The beating, which took place behind a barricaded door in Jurgens' s deluxe mid-Manhattan office, lasted for over 20 minutes, and was observed via camera by the building' s security staff. Unable to break through the gorilla' s barricade to save Jurgens, they were helpless to do anything but watch the muscle-bound animal pummel Jurgens with blow after blow, expertly wielding the suitcase as a bludgeoning tool. The gorilla, born in the lowlands of Central Africa and transported to the United States at age two, seemed ' possessed of an almost deliberate single-mindedness, clearly seeking revenge for an age-old vendetta,'  before and during the attack, police said. The tragic incident began when Jurgens visited the Bronx Zoo during a family outing. Bobo apparently became enraged upon making eye contact with Jurgens during the family' s tour of the zoo' s ' Jungle World'  exhibit. ' He looked right at me,'  Jurgens said from his bed in the Intensive Care Ward of Mt. Sinai Hospital. ' I swear to God, his beady gorilla eyes looked right into mine. It was obvious that our fine product' s wear-resistant design had caused him years of frustration, and that he unleashed this pent-up anger in an outburst of savage catharsis.'  Shortly after seeing Jurgens, the animal ' went ballistic,'  according to witnesses, leaping over the concrete safety pit surrounding the enclosure and repeatedly tearing at the iron bars separating him from zoo visitors with his teeth and fists. Eight zoo staffers and large doses of tranquilizers failed to subdue the creature, who finally escaped by tearing a set of keys from a zookeeper' s belt. He resumed his pursuit of Jurgens, eventually catching up to him at his downtown office, where he trapped him in the penthouse and barricaded the door. All told, Bobo pursued Jurgens, who had risen to prominence within Samsonite' s ranks after featuring Bobo in a highly successful advertising campaign in the mid-' 70s, for over four miles. In the process, Bobo fended off capture attempts by no fewer than 12 zookeepers, a fully mobilized unit of horse-mounted police, and over 20 highly-trained Samsonite security guards. Although several of these men and women were mildly injured in their failed attempts to subdue the primate, the only person to sustain serious, prolonged injury was Jurgens, whom the revenge-crazed animal ' deliberately singled out,'  according to several witnesses. Zoo authorities claim the animal has never shown any sign of violent behavior. In fact, sources said, Bobo has always been an unusually docile gorilla, his friendly and responsive demeanor making him a favorite among children. ' He' s such a cooperative animal that it seemed natural to use him in the television commercial,'  Bobo' s trainer and personal attendant, Hank Prando, said. ' Little did we know that the luggage' s exceptionally fine craftsmanship would prove too much for the poor beast' s mind to take.'  After finishing the near-fatal beating, Bobo calmly sat down and rested for a few moments, then proceeded to quietly remove the office door' s barricade and surrendered peacefully to authorities. ' He seemed so happy,'  said one policeman present at the animal' s surrender. ' As they took him away, I saw a look in his eyes of utter peace. It was as if a weight he' d been carrying for years had finally been lifted from his shoulders.' ","archive, revenge, archive, vol 29 issue 02, the onion"
216,Native Americans Ask Very Nicely For Country Back,"A delegation representing a broad range of Native American governments converged on Washington, D.C., today, presenting a prepared statement before Congress. The statement, described as ' extremely polite and respectfully worded,'  asked the U.S. government very nicely to return America to the Native American populace. ' We would like, pretty please, with a cherry on top, if we may, to have our country back now, that is, if it' s alright with you, and you' re done with it, if it' s not too much trouble, please,'  a portion of the statement read. Reaction to the courteous request was uniform and positive. ' What a nice gesture,'  Sen. Franklin Hall (D-VA) said. ' And darn neighborly of them too. We' ve broken all our treaties with them, and still they thought to include this lovely card. Look, it says ' Thinking of You,'  and it has a beautiful picture of a sunset on it.'  Hall went on to say that he was particularly impressed with the tribal leaders'  manners in light of the near-wholesale destruction of their populace, not only through military actions and pogroms, but also germ warfare and economic terrorism. When asked if he would give the country back, Sen. Hall replied: ' No, I do not think so.'  He then disappeared into his Congressional chambers, where he and several of his staffers shared what was described by observers as ' a long, hearty laugh.'  Sen. Ben Nighthorse Campbell (R-CO), the only Native American in Congress, was absent, having been tricked by the other Senators into trading his senate seat for a bag of delicious, fruit-flavored gummy bears. Also impressed with the exceptionally polite Native Americans was Secretary of the Interior Bruce Babbitt, who told reporters that the tact, evenness of manner and congeniality of the Native Americans was one of the most touching displays of civic pride that he as an elected official had ever witnessed. ' The behavior of these noble Indians is truly moving,'  Babbitt said. ' I mean, you' d think they' d be more angry about it, after being force-marched for all those thousands of miles along the Trail of Tears in the dead of winter, dropping like flies from the ravages of smallpox.'  When asked if he favored returning America to them, he replied, ' Why, no.'  He recommended Native Americans focus their energies on building quality gambling facilities, rather than spending time trying to restore their people' s self-sufficiency and pride. Babbitt could very easily see the government donating money to that cause, ' seeing that most states would never sully their own land with the boozing and whoring that so frequently accompanies such endeavors.'  Despite sympathetic reactions, the delegation was not allowed into the legislative chambers due to time constraints, and instead had to deliver its statement and accompanying fruit basket via congressional page. After waiting 17 hours, it formed a circle and invoked the ancient ' Mashkawon'  ceremony, sitting and chanting quietly to protest the extensive delays. When the group did not move off the Capitol lawn after being asked to leave by security, the delegation was incinerated by air-to-surface missiles.","politics, archive, news, vol 29 issue 02, politics"
