,Headline,Body text,Meta Tags
134,Hero Fireman Saves Child Trapped in Bob Dole,"PLAINFIELD, NE' In an inspiring display of modern-day heroism, Plainfield fireman James Pagnozzi yesterday saved the life of area resident Janie Siles, 4, who became caught in Republican presidential front-runner Bob Dole while exploring an abandoned barn. Siles, who was nearly crushed to death by the candidate' s case-hardened internal gears and high-speed threshing blades, is recovering at a nearby hospital. Dole, who was breaking in a new John Deere turbodiesel engine between stumping spots at the time, said he was unaware of the child playing nearby and denied responsibility for the accident. ' Bob Dole is clearly marked with warning stickers stating ' Do Not Play On Or Around Bob Dole,' '  he said. ' Bob Dole is not a toy. Bob Dole is the latest in modern self-supporting combine harvesters. Bob Dole will be the next President of the United States.'  It is believed to be the worst Dole-related accident since the Kansas senator was converted from steam propulsion after a boiler explosion killed two migrant workers in August 1916. According to police, Siles was attracted by the shiny, moving shapes within Dole' s open hip panel and, reaching in, became engulfed in the candidate' s machinery. Fortunately for Siles, the nearby Pagnozzi heard her screams and was able to pry open Dole using a ' Jaws of Life' -style hydraulic device. ' I' m no hero,'  Pagnozzi stated modestly while recuperating. ' I was just doing my job. But mark my words, those Bob Dole things are extremely unsafe. There aren' t any safety interlocks on his access panels or grain feed channels to prevent this kind of thing. If people keep heavy agricultural machinery such as Bob Dole running unattended, this sort of thing will keep happening.'  Dole, mistakenly left unattended with his side-access panel un-locked, expressed regret at the accident and gratitude toward Pagnozzi for saving the child' s life. ' Bob Dole sees safety as a big concern for Bob Dole,'  Dole said. ' Bob Dole is saddened by this little girl' s trauma, and Bob Dole thanks the Plainfield Fire Department for its quick intervention. Bob Dole will lead this country into the 21st century.'  An internal investigation is underway to determine the reason Dole was left unattended at a crucial point in his seasonal maintenance cycle, a time when he is normally surrounded by a security team. ' Bob Dole is not dangerous when properly handled by trained agro-technical personnel,'  the candidate said, ' Bob Dole will be the next president of the United States!'  Siles, now listed in stable condition, lost three fingers as a result of the accident. Emergency personnel searched valiantly for her severed digits so they could be surgically reattached, but after several hours the search was aban-doned. Ex-perts a-greed that the missing fingers must have already been sheared off, crushed in Dole' s grain hull/separator, and disposed of like chaff by being passed through his wastegate. ' Bob Dole cannot be blamed for tur-ning the Siles girl' s digits into processed silage,'  Dole said. ' Conversion of organic substances into food products for consumption by humans or livestock are automatic procedures within Bob Dole over which Bob Dole' s directional programming has no control. Bob Dole makes no apologies.'  Siles refused to speak to reporters about the candidate, responding to their questions with cries of, ' Tractor bad! Tractor hurt Janie! No more tractor man!'  That sort of reaction, Dole campaign staffers say, is typical in small children when ex-posed to Dole' s internal me-chanics. ' Janie will in all likelihood be plagued by nightmare-like flash-backs for years to come,'  Dole spokes-person Ri-ta Loew said. ' We are confident, though, that as the wound-trauma sub-sides, the child will eventually lose its fear of Dole and learn to accept the device as its new leader.'  ' Bob Dole is not scary,'  Dole stressed. ' Bob Dole is going to defeat Bill Clinton in November the way Bob Dole defeats broadleafed weeds in summer. Bob Dole will be adored by children and parents alike as the new low-maintenance, twin-turbine leader of the free world.' ","politics, archive, news, vol 29 issue 14, politics"
135,Federal Law Enforcement Officials Unveil New Food-Crime Equivalency Ratings,"WASHINGTON (AP)' A unilateral caucus of the nation' s law enforcement officials yesterday unveiled America' s new food-crime equivalency ratings for 1996 . Passed unanimously, the ratings take effect May 1 and will be enforced in all 50 states, as well as Puerto Rico and the U.S. Virgin Islands. Initially enforced on a state-by-state basis, 1996 will mark the first time the ratings are consistent throughout the nation. The nation' s governors expressed relief that each state' s worst food-crime offenders could no longer simply go across the border to a state with more lenient punishments for certain food crimes. Said Maine Governor William Ryan: ' I am very comfortable knowing that if someone is caught with poultry in my state, they will now be subject to the same criminal charges (manslaughter) as they would in any other state.' ","politics, archive, news in brief, vol 29 issue 14, politics"
136,Homo Sapiens,,"science & technology, archive, graphical feature, vol 29 issue 14, the onion"
137,American Cancer Society Unveils 1.2 Megaton Anti-Cancer Missile,"The American Cancer Society unveiled a promising new weapon in the war against cancer yesterday, a 1.2-megaton anti-cancer missile. The powerful missile, a converted nuclear warhead fitted with special cancer-eradicating plutonium, has been tested vigorously on cancer patients on a top-secret military atoll near Guam, with a 100 percent cure rate. Pending FDA and Pentagon approval, the weapon could be used on U.S. cancer patients as soon as May. ' This is our boldest and most effective strike yet against this life-taking disease,'  ACS chairman and former McDonnell Douglas CEO William McNair said. ' Our island tests indicate that when the missile is fired at a cancer patient, the disease is instantly eradicated.'  The treatment will work not unlike a medium-range ballistic nuclear missile. It will be computer-locked on its target and launched from an underground silo in Nevada. The missile' s curative powers trigger on impact, exploding with a force 400 times more powerful than that of the 1945 Hiroshima bomb and destroying all cancer cells within a 35-square-mile radius. The missile is said to have some side-effects, including nausea, headaches and the eradication of all other forms of life within a 35-square mile radius. Through March, when testing stopped due to seismic disturbances in the Pacific rim, the $40 million surface-to-patient missile had a 100% success rate, besting such commonly used treatments as chemotherapy (36%), radiation (41%), surgical removal (27%), homeopathy (11%), and prayer (61%). ' In every case, save one or two, the treatment has worked,'  McNair said. ' And, in the cases when the treatment failed, it was only because the patients were not in the designated strike area when the missiles hit.'  Cancer patients expressed hope at the prospect of a new treatment with such a high success rate. ' Though my skin cancer is in remission, I am excited to try this new treatment,'  cancer patient Judith Miles said. ' Why wait the few more months when I can now eliminate it in one fell swoop?'  Added Derrick Thorner, who suffers from lung cancer: ' My cancer is very serious, so I will probably encourage them to use higher mega-tonnage.'  Skeptics of the treatment have expressed concern with the side-effects of the new technology, particularly its tendency to destroy all life and property in the vicinity of the patient. ' Our initial reports indicate that if a patient was treated in, say, New York, where over 14 million people are concentrated in a small area, many if not all of the 14 million could be destroyed along with the cancer cells,'  New England Journal of Medicine editor Dr. Daphne Lehman said. ' Whether that is too large a price to pay to defeat this deadly disease remains to be seen.'  Added American Medical Association chair Dr. Fran Stern: ' Look at Jonas Salk. He is a legend in the medical community. But when he introduced the notion of killing every first-born child to reduce polio, people said he was a genocidal maniac.' ","science & technology, health, archive, news, vol 29 issue 14, the onion"
138,Stop Mocking My Antennae,"Quit making fun of my antennae. I' m sick and tired of you slurring my heritage. You, the bastard issue of coarse yeomanry. I' m unique. Only the bluest of blood courses through my veins. And that' s not because I drank some Wisk yesterday. Well, it' s part of the reason. I love Jesus more than anything on this diseased earth. I have decided to build my new church near the E-Z-2 Shop on East De-la-ford. That way, after services, I can stop in there and buy Swishers. Between beatings, my father would tell us tales of the merchant marines, and of the famed lobster-whore of Singapore. My father was the greatest man I ever knew, and he met a tragic demise shortly after contracting the dreaded pleurisy. Actually, it was a virulent strain of scabies. Nonetheless, I have made the solemn vow to not rest a single moment until I have tracked down and killed the American Medical Association. As a citizen of the Nation of the United States I demand an audience with Little Debbie. Why are the individually-wrapped Fudgies whole, and the boxed ones scored? How does she sleep nights? I once knew a little girl in a checked dress, just like her. I already apologized to the family' what more do you want of me? By the way, I didn' t want to mention this before, but you kind of smell. I think you would be wise to consider the use of soap, warm water and clean linens before we proceed any further with our friendship. I' m tired of Washington, with their Marshall Plan, their gasohol, and their metric system! And I resent the fact that the land assessor' s office no longer returns my calls. Down with the tyranny! I think everyone in the U.S. should be gathered into an enormous pen and fed pellets. Except for me. I' d prefer to live in the Shell filling station on Chess Boulevard, because I like the smell of the air hose. Sometimes I dream at night of the Michelin Man slowly rocking, rocking, rocking me to sleep in his big pneumatic arms. Bring back Priscilla' s Pop! I miss the comic stylings of Hollyhock. I never learned if Chester ever bounced his ball off the library steps. You do not end an epic novel in the middle of its narrative! Bring that back and the whist column. Speaking of which, have you seen my ratchet set? I usually kept it in that steamer trunk by the lake. I' ll bet anything those merganser ducks made off with it again. Curse you, merganser ducks! You can' t trust any of your valuables around them. I just counted all the words I have written so far, and the tally comes to 373 (or 374 if you consider ' mention'  a word, which I emphatically refuse to do). For the young peo-ple who may be reading this and are considering taking up the essayist mantle, may I offer this tidbit of sagacity: Journalism is a filthy gutter trade fraught with vice and whoredom. So, as we gaze searchingly into the cerulean sky that shelters us all, we are left to indeed wonder about the meaning, if any, of it all. It is to the Creator that I pose this most humble of queries: Can I go to bed now? I' m both tuckered and nackered and desire sleep.","opinion, archive, commentary, vol 29 issue 14, life on mars lorraine mars, the onion"
139,Racist Figurines March On Washington,"WASHINGTON, DC' Calling themselves ""insulting caricatures born of bigotry"" and ""demeaning portrayals bearing no resemblance to actual human beings or cultures,"" an estimated 400,000 so-called jigaboos, pickaninnies and darky po' boys representing racist statuary from across the U.S. marched on Washington Monday. Decrying their own existence, the figurines demanded that legislators acknowledge them as ""the unwanted remnants of a bygone and hateful era"" and take immediate steps toward abolishing racially stereotyped imagery like themselves. ""Look at me,"" Uncle Ben, a desexualized, rice-peddling ""Good Slave"" archetype, told fellow rallygoers. ""I'm nothing like a real person. Look at my coveralls, my smiling, bug-eyed expression of passivity and subjugation. Clearly, I never should have outlasted the antebellum era, yet I'm still a widely recognized pop-cultural icon. I'm so angry I could boil in just five to ten minutes."" Ben and his female counterpart Aunt Jemima, a genial, syrup-filled ""Matron Servant"" archetype, led the crowd in chanting slogans such as ""Jockey No More"" and ""Hold Your Own Pony!"" Jemima encouraged the crowd to resist caricatured representation of African Americans by hurling themselves from shelves and by falling over on lawns and golf courses. ""We came all the way from a kitchen cabinet in Valdosta, GA,"" said one pair of grinning, apron-wearing salt-and-pepper shakers. ""Never again will we add zesty flavor to soups and meals for The Man."" Another protester, a straw-hatted, gap-toothed, barefoot fisherman commonly used as lawn ornamentation in rural areas, was removed by police after damaging a public birdbath. Led away by authorities amidst the cheers of supportive marchers, the statue told reporters he will go on a hunger strike until he and all images like him are smashed into tiny pieces of ceramic debris. The march began at the Washington Monument and concluded a short distance later at the U.S. Capitol. Featured speakers at the event included not only statuary but other forms of racist iconography as well, including characters from the once-popular children's book Little Black Sambo and several maidservants from Gone With The Wind. In a moving gesture of solidarity, Hollywood detective hero Charlie Chan and his so-called ""hon'able numba' wan son,"" as well as cartoon mouse Speedy Gonzales, spoke on behalf of other racially and culturally stereotyped media constructs. Also in attendance at the rally were famed Mark Twain character Nigger Jim and folk-tale trickster Br'er Rabbit, both of whom cautioned protesters about the difficulties posed by archetypes that, on the surface, appear to be racist but may simultaneously function as an anti-racist critique. Said Jim: ""In the hundred-some years since my creation, critical reappraisals have affirmed me as an enduring symbol of Twain's abolitionist sympathies. Yet these same appraisals acknowledge that my exaggerated, overly stereotypical manner of speaking is at least somewhat problematic."" The presence of Br'er Rabbit' a traditional African folk character brought to America by slaves but later distorted by a white journalist in the ""Africanist"" reductivism of ""Uncle Remus""' angered many rallygoers. He was eventually removed by a team of socio-political literary analysts from Howard University. The controversial rabbit later escaped by convincing his captors to throw him into a briar patch, and his current whereabouts are unknown. The non-violent march, which D.C. police officials praised as the most orderly and well-run protest in recent memory, ended at sunset with a candlelight vigil and ceremonial bonfire of the march's many wooden participants.","politics, archive, culture, news, vol 29 issue 14, politics"
140,Miss America Called Before U.N. Council for Not promoting Enough World Peace,"NEW YORK' Miss America 1996, 24-year-old Angela Pierce, was called into question Sunday during a special U.N. session for what many member nations believe to be her failed promise to effectively promote world peace. According to the U.N.' s special secretary for world peace-related affairs Gavin Theweles, ' Your failure, Miss Pierce, to achieve world peace is in direct conflict with your stated promise to do so in the interview round of the 1995 Miss America Pageant.'  Pierce, a college student from Tacoma, WA, was censured in a U.N. resolution passed by the 64-nation body. It also made reference to her other failed promises, made during the gala pageant held in Atlantic City last July, declaring that she had ' not made the world a significantly safer and more loving place in which to raise her future children,'  and had ' only been marginally supportive of the other girls in the pageant.'  The committee did, however, commend Miss America for looking elegant in evening wear. As the 2020 presidential race heats up, attention has turned to presidential polling and the wisdom of relying on an industry that generally predicted the wrong outcome in 2016. The Onion takes a look at the history of presidential polling. 1935: George Gallup founds American Institute of Public Opinion in attempt to quench his endless thirst for juicy voter gossip.        ","politics, archive, news in brief, vol 29 issue 14, politics"
141,"Clinton Unveils Re-election Platform: The Politics of Dancing, The Politics of Mmmm... Feelin' Good",,"politics, archive, presidents, graphical feature, vol 29 issue 13, politics"
142,"Egypt: Are Moses, Jews Planning a Pullout?","WASHINGTON' With its vote to adopt a resolution denouncing the freshman' s congresswoman behavior, the House of Representatives formally censured Alexandria Ocasio-Cortez Friday for employing the sexist slur ' fucking bitch'  in a speech on the House floor the day prior. ' The representative from New York' s 14th District is hereby condemned for her unapologetic enunciation of these hateful, abusive words, which not only brought disgrace to this esteemed body but were incredibly demeaning to all womankind,'  House Minority Leader Kevin McCarthy said as he read aloud the official rebuke, adding that as a woman herself, Ocasio-Cortez should have known better than to speak aloud the unconscionable term, let alone read it into the Congressional Record. ' Her appalling speech of July 23 does not reflect the values of the United States Congress, nor does it reflect the example we wish to set for our children' especially our daughters. While this body will not ask what prompted her to adopt such unprofessional language, it will require the representative to issue an immediate apology to her colleagues or face further disciplinary action for her misconduct.'  In his own words, McCarthy went on to observe that it was too soon to tell just how far back Ocasio-Cortez had set ' young ladies'  in Congress with her ' hysterical'  outburst.","world, archive, graphical feature, vol 29 issue 13, the onion"
143,Woman Gives Birth to Own Son,,"local, archive, graphical feature, vol 29 issue 13, local"
144,80-Year-Old Squirrel Demands Softer Nuts,"WASHINGTON' With its vote to adopt a resolution denouncing the freshman' s congresswoman behavior, the House of Representatives formally censured Alexandria Ocasio-Cortez Friday for employing the sexist slur ' fucking bitch'  in a speech on the House floor the day prior. ' The representative from New York' s 14th District is hereby condemned for her unapologetic enunciation of these hateful, abusive words, which not only brought disgrace to this esteemed body but were incredibly demeaning to all womankind,'  House Minority Leader Kevin McCarthy said as he read aloud the official rebuke, adding that as a woman herself, Ocasio-Cortez should have known better than to speak aloud the unconscionable term, let alone read it into the Congressional Record. ' Her appalling speech of July 23 does not reflect the values of the United States Congress, nor does it reflect the example we wish to set for our children' especially our daughters. While this body will not ask what prompted her to adopt such unprofessional language, it will require the representative to issue an immediate apology to her colleagues or face further disciplinary action for her misconduct.'  In his own words, McCarthy went on to observe that it was too soon to tell just how far back Ocasio-Cortez had set ' young ladies'  in Congress with her ' hysterical'  outburst.","animals, archive, graphical feature, vol 29 issue 13, the onion"
145,Weather Map,,"archive, weather, graphical feature, vol 29 issue 13, the onion"
146,How to Stretch Your Social Security Dollars,"Casino Corner Times are tight. And let me tell ya, Gramps, those Capitol Hill types ain' t exactly eager to slip you a coupla extra clams in the old Social Security. For this you worked 40 years at the coal chute? It seems the only part of retired you got was tired! You don' t even have two nickels to rub together after buying your Poligrip and Spam and maybe a nice pint of rye. Well, I' m here to tell you that you just ain' t trying hard enough. You ain' t a mummy yet! And I know what you' re gonna say, you can' t afford it. Hell, you can' t afford not to! Because I got a place where we turn dreams into dollars' and the drinks are free! I own the Metro Plaza Casino Resort, the ideal place to adjust your personal finances! Maybe you' re wondering about the cost. You shouldn' t, ' cause like I said, this is a place that makes your greenbacks work harder for you. What you silver foxes gotta do when you get that Social Security check is cash it immediately and come to the Metro. We got all sorts of investment plans, and every one of ' em is a load of fun. If you wanna start out slow, there' s the slot machines, what you antique types call one-armed bandits. It' s like a vending machine for quarters. You stick in a quarter, and, well, sometimes the vending machine, it' s a bit balky, but what do you expect from these new-fangled contraptions? And, anyhow, if you have good old-fashioned American stick-to-itiveness, a flood of money will come pouring out, just like in the Bible. It' s nice here at the Metro, a true getaway. It' s decorated like a Roman circus and if that ain' t your style, we got a room all decked out like a riverboat with Wild West gals in big skirts and feathers. There' s plenty of cheap meals, too' like all-you-can-eat prime rib for three bucks! And, if you get tired from the excitement, we understand. You can sit at the Blackjack tables. We keep the heat up nice and high for you olds. Now I know you' re saying to yourself' you weren' t born yesterday. And may-be you heard that our casino games here have been associated with gambling. I say sure, that can go on at my joint. I can' t be everywhere at once, can I? The stock market these days, now that is gambling, my gray-headed friends. It' s like 1929 all over again every day out there, and you remember how bad that was. There' s no loaded dice at the Metro, old friends. Just the honest, fun, money-making dice that' ll make you rich. So come on down, and don' t forget those Social Security checks!","opinion, economy, archive, finance, commentary, vol 29 issue 13, hey, bub by bub minter, the onion"
