,Headline,Body text,Meta Tags
68,Bantu Tribesman Uses IBM Global Uplink Network Modem to Crush Nut,"KABINDA, ZAIRE' In a move IBM officials are hailing as a major step in the company' s ongoing worldwide telecommunications revolution, M' wana Ndeti, a member of Zaire' s Bantu tribe, used an IBM global uplink network modem yesterday to crush a nut. Ndeti, who spent 20 minutes trying to open the nut by hand, easily cracked it open by smashing it repeatedly with the powerful modem. ' I could not crush the nut by myself,'  said the 47-year-old Ndeti, who added the savory nut to a thick, peanut-based soup minutes later. ' With IBM' s help, I was able to break it.'  Ndeti discovered the nut-breaking, 28.8 V.34 modem yesterday, when IBM was shooting a commercial in his southwestern Zaire village. During a break in shooting, which shows African villagers eagerly teleconferencing via computer with Japanese schoolchildren, Ndeti snuck onto the set and took the modem, which he believed would serve well as a ' smashing'  utensil. Just after Ndeti shattered the nut, a 200-person Southern Baptist gospel choir, on hand for the taping of the IBM commercial, broke out into raucous, joyous song in celebration of the tribesman' s accomplishment. IBM officials were not surprised the longtime computer giant was able to provide Ndeti with practical solutions to his everyday problems. ' Our telecommunications systems offer people all over the world global networking solutions that fit their specific needs,'  said Herbert Ross, IBM' s director of marketing. ' Whether you' re a nun cloistered in an Italian abbey or an Aborigine in Australia' s Great Sandy Desert, IBM has the ideas to get you where you want to go today.'  According to Ndeti, of the modem' s many powerful features, most impressive was its hard plastic casing, which easily sustained several minutes of vigorous pounding against a large stone. ' I put the nut on a rock, and I hit it with the modem,'  Ndeti said. ' The modem did not break. It is a good modem.'  Ndeti was so impressed with the modem that he purchased a new, state-of-the-art IBM workstation, complete with a PowerPC 601 microprocessor, a quad-speed internal CD-ROM drive and three 16-bit ethernet networking connectors. The tribesman has already made good use of the computer system, fashioning a gazelle trap out of its wires, a boat anchor out of the monitor and a crude but effective weapon from its mouse. ' This is a good computer,'  said Ndeti, carving up a just-captured gazelle with the computer' s flat, sharp internal processing device. ' I am using every part of it. I will cook this gazelle on the keyboard.'  Hours later, Ndeti capped off his delicious gazelle dinner by smoking the computer' s 200-page owner' s manual. IBM spokespeople praised Ndeti' s choice of computers. ' We are pleased that the Bantu people are turning to IBM for their business needs,'  said company CEO William Allaire. ' From Kansas City to Kinshasa, IBM is bringing the world closer together. Our cutting-edge technology is truly creating a global village.'  The Bantu tribesmen are members of an ever-growing, international community of users who have turned to IBM to solve their networking needs. Jean-Claude DuMont, a goatherder from the French region of Brittany who is working on an Indiana University Ph.D. in biology via internet, recently looked into IBM' s new computer-satellite data uplink, which offers instant access to all library files worldwide. ' With IBM' s new uplink service, I can access any file I want, any time I want,'  DuMont told fellow goatherder Pierre Valmont during a recent walk through a rye field. ' I can even find out how many points Michael Jordan scored last night.'  Responded Valmont: ' Radical.' ","science & technology, archive, news, vol 29 issue 20, the onion"
69,Minimum Wage Hike,,"economy, archive, statshot, vol 29 issue 20, the onion"
70,Sports,"Inside: A full-color action poster of Chicago Bulls General Manager Jerry Krause WASHINGTON' With its vote to adopt a resolution denouncing the freshman' s congresswoman behavior, the House of Representatives formally censured Alexandria Ocasio-Cortez Friday for employing the sexist slur ' fucking bitch'  in a speech on the House floor the day prior. ' The representative from New York' s 14th District is hereby condemned for her unapologetic enunciation of these hateful, abusive words, which not only brought disgrace to this esteemed body but were incredibly demeaning to all womankind,'  House Minority Leader Kevin McCarthy said as he read aloud the official rebuke, adding that as a woman herself, Ocasio-Cortez should have known better than to speak aloud the unconscionable term, let alone read it into the Congressional Record. ' Her appalling speech of July 23 does not reflect the values of the United States Congress, nor does it reflect the example we wish to set for our children' especially our daughters. While this body will not ask what prompted her to adopt such unprofessional language, it will require the representative to issue an immediate apology to her colleagues or face further disciplinary action for her misconduct.'  In his own words, McCarthy went on to observe that it was too soon to tell just how far back Ocasio-Cortez had set ' young ladies'  in Congress with her ' hysterical'  outburst.","archive, archive, vol 29 issue 20, the onion"
71,Weather,,"archive, graphical feature, vol 29 issue 20, the onion"
72,Teen Study Bible Found to Increase Fun of Religion by .03%,,"religion, archive, news in photos, vol 29 issue 20, the onion"
73,Bi-Curious Man Dials 1-900 Number,"CHICAGO' Urging everyone to lighten up and ' save the pearl-clutching'  for real problems, local catcaller Will Snyder confirmed Friday that he was not sure what the big deal was because he' d love it if a woman referred to him as a fat, stuck-up bitch. ' No one ever calls me a dumb filthy whore when I' m headed home after a long day of work, but you know what, it sure would be a nice thing to hear every now and then,'  said Snyder, 27, adding that it would be a tragedy if the political correctness of the #MeToo era had reached a point where it might prevent a woman from walking close behind him for several blocks and then telling him he was an ugly, uptight cunt who needed to be fucked hard. ' Honestly, what' s the problem? I' d be flattered if some girl blocked my path on the sidewalk, grabbed her crotch, and told me my big slutty lips would look great on her pussy. That' s a compliment in my book, so don' t act all offended when you hear that kind of thing from me.'  The catcaller then reportedly sighed and reiterated his long-held position that there wasn' t much he could do about it, because they were ' all a bunch of frigid dykes.' ","local, archive, gay & lesbian, news in photos, vol 29 issue 20, local"
74,Area Larva Celebrates Ascent to Adulthood with Bar Moltzvah,"WASHINGTON' With its vote to adopt a resolution denouncing the freshman' s congresswoman behavior, the House of Representatives formally censured Alexandria Ocasio-Cortez Friday for employing the sexist slur ' fucking bitch'  in a speech on the House floor the day prior. ' The representative from New York' s 14th District is hereby condemned for her unapologetic enunciation of these hateful, abusive words, which not only brought disgrace to this esteemed body but were incredibly demeaning to all womankind,'  House Minority Leader Kevin McCarthy said as he read aloud the official rebuke, adding that as a woman herself, Ocasio-Cortez should have known better than to speak aloud the unconscionable term, let alone read it into the Congressional Record. ' Her appalling speech of July 23 does not reflect the values of the United States Congress, nor does it reflect the example we wish to set for our children' especially our daughters. While this body will not ask what prompted her to adopt such unprofessional language, it will require the representative to issue an immediate apology to her colleagues or face further disciplinary action for her misconduct.'  In his own words, McCarthy went on to observe that it was too soon to tell just how far back Ocasio-Cortez had set ' young ladies'  in Congress with her ' hysterical'  outburst.","archive, news in photos, vol 29 issue 20, the onion"
75,World's Best Dad Has World's Worst Arteries,"CHICAGO' Urging everyone to lighten up and ' save the pearl-clutching'  for real problems, local catcaller Will Snyder confirmed Friday that he was not sure what the big deal was because he' d love it if a woman referred to him as a fat, stuck-up bitch. ' No one ever calls me a dumb filthy whore when I' m headed home after a long day of work, but you know what, it sure would be a nice thing to hear every now and then,'  said Snyder, 27, adding that it would be a tragedy if the political correctness of the #MeToo era had reached a point where it might prevent a woman from walking close behind him for several blocks and then telling him he was an ugly, uptight cunt who needed to be fucked hard. ' Honestly, what' s the problem? I' d be flattered if some girl blocked my path on the sidewalk, grabbed her crotch, and told me my big slutty lips would look great on her pussy. That' s a compliment in my book, so don' t act all offended when you hear that kind of thing from me.'  The catcaller then reportedly sighed and reiterated his long-held position that there wasn' t much he could do about it, because they were ' all a bunch of frigid dykes.' ","local, archive, news in photos, vol 29 issue 20, local"
76,Colorado Judge Imposes Ban On Same-Sex Friendships,"In a landmark decision being watched closely by both civil liberties advocates and people who have friends, Colorado Fifth District Judge Stephen T. Rozema yesterday upheld a ban on same-sex friendships in the state of Colorado. The decision, which effectively outlaws ' casual, consensual, mutually friendly relationships between two individuals of the same gender,'  is expected to have a major impact on the legality of same-sex friendships across the U.S. The controversial decision is based on the case of Greeley, CO, residents John Rooney and Frank Costanada, two friends who were planning a weekend rock-climbing trip to Yosemite National Park this July. After their travel agent informed local authorities that she suspected they were friends, a local appellate court blocked the trip, deeming it ' wholly inappropriate.'  ' These two men were in great danger of enjoying each other' s company,'  the judge said. ' They may have attempted to communicate meaningfully with each other, shared stories and anecdotes, or possibly even engaged in physical contact, such as ' high-fiving'  after a successful climb.'  ' Such behavior,'  the judge added, ' is an abomination.'  Judge Rozema expounded on the lower court decision, ruling that ' these sorts of close, mutually agreeable relations between two men are not what God had in mind when he created Adam and Eve.'  He later added, ' This is why they weren' t called Adam and Steve.'  While conservatives are applauding the Colorado decision, many believe it does not go far enough. U.S. Sen. Strom Thurmond (R-SC) recently called for the ban to extend to same-sex conversations, calling them ' unnatural.'  Thurmond is also the author of the much-discussed Proposition D, which would outlaw same-sex locker rooms. ' Men should be showering with women, not other men. Though if they do shower together, they should be legally married before God.'  Two states, Missouri and Louisiana, have already made same-sex locker rooms illegal, instituting a mandatory co-ed policy that requires all showerers to be paired up with a partner of the opposite sex and be legally married before entering the bathing area. Kansas City resident Jennifer Jacobs, 34, was recently wed before showering at her health club with Gene Skellings, a 63-year-old executive from the suburb of Mitchell Park. ' I wanted to work out and then take a shower,'  Jacobs said. ' But in accordance with the law, I married Mr. Skellings and will serve him as my husband for the rest of my life.'  President Clinton, who, despite supporting same-sex friendships in the 1992 campaign, calling them ' valuable and nurturing bonds that fit the definition of acceptable behavior as prescribed by the Lord Christ in Heaven,'  was pleased by the judge' s decision. ' I very much support eight-to-ten person same-sex gatherings, such as ladies'  bridge groups or men' s poker nights,'  said Clinton, who confessed to playing in a monthly high-stakes poker game with top generals and heads of the military industrial establishment. ' Two men alone, though' no way.'  Despite President Clinton' s support, rumors persist that Clinton himself has engaged in a friendship with former U.S. Energy Secretary James McEwen, with whom he has periodically been seen eating lunch. ' Mr. McEwen is an associate of mine, and our lunches are strictly strategy sessions,'  Clinton said. Clinton did not deny, however, that when playing golf with McEwen, they sometimes walk ahead of Secret Service agents and are briefly alone, a practice that has prompted many to question Clinton' s suitability as a moral leader. The Colorado ban is expected to pave the way for other states, many of which have similar legislation pending. Conservatives are working hard to not only ban same-sex friendships on a national basis, but also to outlaw any asexual reproduction in the single-cell invertebrate community. ' These filthy and immoral invertebrates are not acting in accordance with the Bible and, by His holy Word, must be put to death,'  Thurmond said.","politics, archive, gay & lesbian, courts, news, vol 29 issue 20, politics"
77,Clinton Breaks Off Talks with Carpetland,"Washington, D.C. ' After months of deteriorating relations, President Clinton yesterday announced that the U.S. has broken off talks with Carpetland and its friendly, helpful team of sales associates. The break, which came after an 11th hour disagreement over the terms of the installation of 300 square yards of DuPont Stainmaster II, could leave Clinton without quality carpeting for the November election. The decision to break off talks came at the insistence of several of Clinton' s top advisors, including U.S. Carpet Secretary Daniel Attenbisen, who said a proposed U.S. Monsanto-brand Weardated purchase now would be unwise, as it is too late for the summer selection. The fall double-knit line is widely reported to be the weakest in years. Attenbisen served as Carpetland ambassador under President Ford. Leonard Haveshbaum, Customer Service Representative to the U.S., was regretful over the stalled negotiations and expressed determination to restore good relations with the U.S. ' President Clinton is a valued customer,'  said Haveshbaum, speaking from Carpetland' s brand-new store at Pflaum Road and Highway 351. ' He is welcome to visit any one of our 21 convenient D.C.-area Carpetland locations at any time, should he make a firm decision on his carpet and carpet-related needs.'  Added Haveshbaum: ' Our low prices will floor you.'  Despite the break in talks, Clinton stressed the importance of U.S.-Carpetland relations in a formal statement released yesterday. ' I believe in Carpetland and what it can offer the American people. I believe that only the highest quality carpets at the lowest possible factory-outlet prices should be purchased,'  the statement read. ' Carpetland and the U.S. were allies in the Fourth of July Carpet Blow-Out of 1968, and on through to the Shag Crisis of the mid-' 70s. I would like to assure the American public that the impasse reached in these talks in no way lessens our commitment to the people of Carpetland.'  Clinton has not ruled out bombing Carpetland. Though the White House tried to head off any speculation as to why Clinton broke off the talks, one report hinted that there had been no agreement on the particulars of a White House-wide free-installation accord. Others speculated that Carpetland was holding out on the free Stainguard treatment given to all customers who purchase 100 square feet or more. There was also concern that Clinton low-balled Haveshbaum and then offered assurance that Carpetland' s Labor Day Carpet Sale-abration would be granted Most-Favored-Sale status by the U.S.' something no president has done since Grover Cleveland. The White House made sure to inform the press yesterday that color was not a factor in the decision, and supported this claim by passing around a DuPont Stainmaster II sample book complete with the President' s pre-approved colors. With talks on hold, Clinton has not stood still in the quest for quality carpet at discount prices, urging his Joint Chiefs to recommend another carpet store in the area. The Joint Chiefs are expected to recommend that Clinton call Crazy Hal' s Carpet and Tile Warehouse, where, according to a recent Pentagon report, the lowest prices are guaranteed. There is some concern among senior officials, however, that Crazy Hal' s prices are low only because Crazy Hal may be clinically insane, and therefore lacks the necessary cognitive powers to determine a fair price for carpets, tiles, and other floor coverings. ' I am aware that Crazy Hal is considered ' insane'  to sell carpet at the low, low prices he does,'  Clinton said Monday, speaking at the Naval Academy' s Commencement in Annapolis, MD. ' If Crazy Hal is indeed mentally unsound, we will consider a course of action appropriate for dealing with an insane person in the arena of discount carpet.' ","politics, archive, bill clinton, news, vol 29 issue 20, politics"
78,Coping With Gas Prices,,"economy, archive, statshot, vol 29 issue 18, the onion"
79,"Weather - Week Of May 14, 1996",,"archive, graphical feature, vol 29 issue 18, the onion"
80,Kathie Lee's Children,,"entertainment, archive, graphical feature, vol 29 issue 18, entertainment"
81,Sigmund Freud vs. Sigfried and Roy,A Psychoanalytical Comparison,"archive, graphical feature, vol 29 issue 18, the onion"
82,Hard Times Hit Springsteenville,"SPRINGSTEENVILLE, U.S.A.' Across America, cities are facing shrinking job bases and plant closings. But nowhere has the recent industrial slowdown hit harder than Springsteenville. A blue-collar, rust-belt city whose 75,000 inhabitants are almost all factory-employed Vietnam veterans, Springsteenville was once considered an ideal American town, but now faces a state of economic emergency. ' Our glory days have passed us by,'  says Mayor Joe Roberts, whose parents came to Springsteenville in 1951 to work in the city' s then-booming auto plant. ' The situation is similar to the wink of a young girl' s eye.'  With the recent closing of Springsteenville' s textile mill, located across the railroad tracks, unemployment has hit an all-time high of 34 percent. ' It seems like there' s always another plant closing down,'  Roberts lamented. ' Once we stood for a hard day' s work for a day' s pay. But now, these jobs are going, boys. And they ain' t coming back.'  ' To your hometown,'  the mayor continued. ' Your hometown.'  Unemployment is at an all-time high in Springsteenville, and it appears that spirits have never been lower. Most of the city' s workers served their country bravely in the 1960s and ' 70s, when, after getting in a little hometown jam, they had rifles thrust into their hands. ' I was sent to a foreign land,'  said Kyle Braley, who works on the highway in nearby Darlington County. ' To go and kill the yellow man.'  In the 1980s, Springsteenville was a symbol of working-class pride and patriotic vigor, but by 1996, Springsteenville has seen better days and is increasingly in danger of becoming a sad caricature of its former self. One petroleum worker (who asked not to be named) said that upon returning from Vietnam he had gone back to the refinery, but the hiring officer refused him, saying that, son, it was unfortunately not up to him. The veteran then tried approaching his V.A. man, who similarly replied, ' Son, don' t you understand?'  Adding to Springsteenville' s woes is the recent drastic rise in teen delinquency. Fueled by the perception among youth that the city is both a death trap and a suicide rap, many teens are getting out while they are young. Underage drinking is an epidemic and teen pregnancy is at an all-time high, as many high school-age teens go down to the river, despite the fact that the river is dry. Some teens are proving it all night, typically out in the street. Others, such as local teens Bobby Jean, Wendy and Rosalita, have opted simply to run away. One disaffected factory worker told reporters that life in Springsteenville makes him feel as if someone took an edgy, dull knife and cut a six-inch valley through the middle of his soul. He also noted that he is on fire. Compounding Springsteenville' s economic woes are the city' s tremendous traffic problems, with many residents turning to their automobiles as a way out. Among the most popular auto-related escapes: driving all night, racing in the street, cruising on the oft-visited Thunder Road, and driving either stolen or used cars. ' It' s true,'  Mayor Roberts confirms. ' Our highways are jammed with broken heroes on a last-chance power drive. This is terrible, and not just because of the risk of a tragic wreck on the highway. We can' t have kids thinking that they can skip some school, shoot some pool, act real cool, stay out all night, and it will be all right.'  The rising tide of hopelessness among Springsteenville' s young has contributed to an equally swift rise in the crime rate. Residents of the suburbs are afraid to go out at night, largely due to a recent, much-publicized freeze-out on 10th Avenue. ' I was stranded in the jungle trying to take in all the heat they was giving,'  recalled victim Bad Scooter, speaking from his hospital bed. ' I then turned around the corner, and things got extremely quiet, extremely fast.'  Police are still investigating the incident. The Associated Press contributed to this story.","entertainment, archive, news, vol 29 issue 18, entertainment"
83,Award-Winning News Team Keeps Southern Iowa Man In Touch With Southern Iowa,"DES MOINES, IA' With its accurate, up-to-the-minute coverage of local news, weather and sports, the award-winning News-6 team keeps Southern Iowa TV viewer Cal Fenert in touch with Southern Iowa, it was learned yesterday. According to Fenert, ' I feel that I can depend on News-6.'  The Des Moines-based News-6, broadcast on local ABC affiliate KNZR, airs nightly at both 6 and 10. ' This means that if I miss the 6 o-clock news,'  Fenert said, ' I can stay in touch by tuning in to a wrap-up of the news that shapes my world at 10.'  Fenert, a retired auto worker, added: ' I look forward to joining anchorpersons Melanie Washbeyer and Jeff Crim, as well as meteorologist Steve Schaffer, with Bob Keenan on sports.'  According to reports, Fenert had only occasionally watched local news in the past; he was not aware that News-6 was putting him in touch with Southern Iowa until he saw its promotional advertisement on TV. In the ad, the News-6 team is shown individually, sitting on stools in front of a soft-colored background accompanied by synthesized music. ' We' re keeping you in touch with Southern Iowa,'  Washbeyer says in the promo, looking away from the camera as if talking to a reporter. Said Fenert, ' I am kept in touch because the News-6 van is always on the scene when late-breaking news happens. Their experienced team of reporters is always on the NightBeat.'  Thanks to the three-time local Emmy-nominated news team, Fenert has also been kept in touch with kids and the community. ' News-6 takes time out for kids, and cares about the community,'  Fenert said. ' That' s why they feature Kid Care Mondays. And that' s also why they feature the Good Neighbor Watch, which once a week profiles someone right here in my own community who' s making a difference.'  ' We' re doing our job right if Cal Fenert feels as though he' s in touch with Southern Iowa,'  News-6 general manager Neil Roukman said. ' When Cal Fenert needs the latest coverage of local events, he can count on News-6.'  Roukman added that, like Fenert, he also cares about kids and the community. According to reports, when Fenert needs all the local sports scores, Bob Keenan of News-6 Sports provides them. ' I give Cal Fenert the latest pro and college scores and highlights, as well as update him on what' s happening in the high school scene right here in Southern Iowa,'  Keenan said. ' If you want prep basketball results, there isn' t better coverage in the whole state.'  And Fenert is kept well abreast of local weather conditions by meteorologist Steve Schaffer. ' He employs the latest Doppler radar technology to give me the dependable AccuWeather forecast I need, when I need it,'  Fenert said. Fenert reportedly was kept in touch as recently as last night, when he joined anchorpersons Washbeyer and Crim for the 10 p.m. update. ' I am glad I joined them,'  Fenert said. ' They put me in touch with the news and events that shape my world, and then they put it all in perspective.'  This, say insiders, is how News-6 can put Fenert in touch with the people and the stories that the other networks can' t. News-6 is owned by Trans-GlobalMedia Enterprises Worldwide, Inc., a multi-billion dollar company that owns 607 stations across the U.S. The company was also ruled responsible last month for the chemical spill-related deaths of 80,000 workers at its plastics factory in Dharjahal, India.","local, archive, news, vol 29 issue 18, local"
